Link,Title,Intro
/vinfo/us/security/news/cybercrime-and-digital-threats/osx-creativeupdate-macos-cryptocurrency-miner-distributed-via-macupdate,OSX.CreativeUpdate macOS Cryptocurrency Miner Distributed via MacUpdate ,A new cryptocurrency-mining malware was uncovered targeting macOS systems: — OSX.CreativeUpdate Here's what you need to know. 
/vinfo/us/security/news/cybercrime-and-digital-threats/curbing-the-bec-problem-using-ai-and-machine-learning,Curbing the BEC Problem Using AI and Machine Learning,"Due to BEC’s evolving and treacherous nature, run-of-the-mill best practices and security solutions have become weak to withstand attacks. Find out how advanced solutions that utilize artificial intelligence and machine learning help in defending against BEC."
/vinfo/us/security/news/cybercrime-and-digital-threats/no-macros-required-design-in-rtf-and-vulnerability-in-office-exploited-to-deliver-formbook-rat,No Macros Required: Design in RTF and Vulnerability in Office Exploited to Deliver Formbook RAT,Security researchers uncovered a multi-stage attack chain that takes advantage of a design behavior in RTF files and a vulnerability in Microsoft Office (CVE-2017-8570) to deliver the Formbook RAT. 
/vinfo/us/security/news/cybercrime-and-digital-threats/snake-and-proton-malware-found-targeting-mac-users,Snake and Proton Malware Found Targeting Mac Users,Two remote access Trojans targeting Mac users are making headlines: Snake and Proton. Know more about their malicious tricks and how to mitigate them.
/vinfo/us/security/news/cybercrime-and-digital-threats/ransomware-recap-patcher-ransomware-targets-macos,Ransomware Recap: Patcher Ransomware Targets MacOS,"A MacOS ransomware, a disguised Venus Locker variant and other notable ransomware stories from February 16-24, 2017."
/vinfo/us/security/news/cybercrime-and-digital-threats/skimer-atm-malware-updated-turns-atm-into-skimmer,"Skimer ATM Malware Gets Updated, Turns ATMs into Skimming Machines ",Cybercriminals known as the Skimer Group are reusing the malware they created to target ATMs seven years ago—posing a more sophisticated and advanced threat to banks and customers around the globe. 
/vinfo/us/security/news/cybercrime-and-digital-threats/microsoft-rolls-out-office-2016-with-anti-macro-malware-feature,Microsoft Rolls Out Office 2016 With Anti-macro Malware Feature,Microsoft is rolling out Office 2016 with an anti-macro malware feature. We tell you all about it and how to activate it.
/vinfo/us/security/news/cybercrime-and-digital-threats/keranger-ransomware-target-mac-users-bittorrent-client,KeRanger: First Ransomware to Target Mac Users Found in BitTorrent Client,"KeRanger, believed to be the world's first ransomware specifically designed to infect OS X machines has been found piggybacking on a compromised installer of a BitTorrent client. "
/vinfo/us/security/news/cybercrime-and-digital-threats/new-crypto-ransomware-locky-uses-word-macros,New Crypto-Ransomware Locky Uses Malicious Word Macros,A new crypto-ransomware type called Locky has been discovered riding on document-based macros and using infection techniques borrowed from the notorious banking malware DRIDEX.
/vinfo/us/security/news/cybercrime-and-digital-threats/the-smb-problem-pos-malware-skimmers-and-compromised-pos-machines,"The SMB Problem: PoS Malware, Skimmers, and Compromised PoS Machines","SMBs accounted for 45% of all incidents involving PoS malware in Q3 2015, but malware isn't the only thing that retailers have to worry about. PoS machines can be compromised even before they get installed. "
/vinfo/us/security/news/cybercrime-and-digital-threats/20-years-of-macro-malware-from-harmless-concept-to-targeted-attacks,20 Years of Macro Malware: From Harmless Concept to Targeted Attacks,It's been 20 years since the first macro malware was discovered in 1995. Here's how it evolved through the years. 
/vinfo/us/security/news/cybercrime-and-digital-threats/banking-threats-atm-malware-used-to-hack-machines,Banking Threats: ATM Malware Used to Hack Machines,"Last month, a Latin American organized crime gang hacked over 14 ATMs in Malaysia, pilfering an estimated RM3mil (almost $1 million USD). While the incident only affected the banks that were hit, there are other threats that target ATM users as well. "
/vinfo/us/security/news/cybercrime-and-digital-threats/macs-face-new-threat-with-iworm,Macs Face New Threat with iWORM,"Right on the heels of the Shellshock comes another threat that targets Mac users. Known as iWORM, this malware connects to a C&C; server, allowing it to perform actions ranging from information theft and file downloads to configuration changes."
https://www.securityweek.com/who-hacked-french-president-elect-emmanuel-macrons-campaign,Who Hacked French President-elect Emmanuel Macron's Campaign?,"Who did hack Macron? The obvious conclusion is Russia; because Russia would benefit most from a Le Pen victory. But the timing of the document leaks was far too late to benefit Le Pen, and would more likely benefit Macron.  [Read More]"
https://www.securityweek.com/us-alerted-france-russia-hack-targeting-macron-nsa,U.S. Alerted France to Russia Hack Targeting Macron: NSA,"NSA Director Admiral Mike Rogers said that Russia was behind the hack of French President-elect Emmanuel Macron's campaign team, and that US officials had informed France a cyber-attack was underway.  [Read More]"
https://www.securityweek.com/turla-cyberspies-developing-mac-os-x-malware,Turla Cyberspies Developing Mac OS X Malware,Russia-linked Turla cyberspies are apparently working on developing a Mac OS X version of their Snake malware  [Read More]
https://www.securityweek.com/machete-continues-spy-spanish-speaking-countries,'Machete' Continues to Spy on Spanish-Speaking Countries,Machete cyberespionage group continues to target organizations in Spanish-speaking and other countries  [Read More]
https://www.securityweek.com/russian-cyberspies-use-new-mac-malware-steal-data,Russian Cyberspies Use New Mac Malware to Steal Data,"Russia-linked threat group APT28 (aka Pawn Storm, Fancy Bear and Sofacy) created a Mac version of its X-Agent Trojan  [Read More]"
https://www.securityweek.com/iranian-hackers-use-mac-malware-steal-data,Iranian Hackers Use Mac Malware to Steal Data,Cyber espionage group linked to Iran uses Mac malware named MacDownloader to steal data from infected devices  [Read More]
https://www.securityweek.com/windows-and-mac-users-targeted-malvertising-campaign,Windows and Mac Users Targeted in Malvertising Campaign,"Cybercriminals have been serving malicious advertisements on several high-profile websites in an effort to push shady software onto the computers of their visitors, regardless if they are Windows or OS X users, Cisco reported on Monday.  [Read More]"
https://www.securityweek.com/machete-cyber-espionage-attacks-target-spanish-speaking-countries,'Machete' Cyber Espionage Attacks Target Spanish-Speaking Countries,"The malware at the center of the 'Machete' cyber attacks is capable of a number of actions, including logging keystrokes, capturing audio and screenshots, taking photos from the victim's webcam and capturing geo-location data.  [Read More]"
https://www.securityweek.com/dok-mac-malware-used-target-swiss-banks,'Dok' Mac Malware Used to Target Swiss Banks,A variant of the Dok malware for Mac targets Swiss banking users in attacks that appear to be part of Operation Emmental  [Read More]
https://www.securityweek.com/malicious-rtf-persistently-asks-users-enable-macros,Malicious RTF Persistently Asks Users to Enable Macros,"A malicious RTF (Rich Text Format) document has been persistently displaying an alert asking users to enable macros, Zscaler security researchers have discovered.  [Read More]"
https://www.securityweek.com/macro-based-multi-stage-attack-delivers-password-stealer,Macro-Based Multi-Stage Attack Delivers Password Stealer,"A malicious attack uses a multi-stage infection to deploy a tool capable of stealing passwords from various applications on the victim’s computer, Trustwave reports.  [Read More]"
https://www.securityweek.com/macupdate-distributes-mac-crypto-mining-malware,MacUpdate Distributes Mac Crypto-Mining Malware,Maliciously modified copies of popular applications distributed via the MacUpdate site were observed installing crypto-mining malware on the users’ Macs.  [Read More]
https://www.securityweek.com/crypto-mining-botnet-ensnares-500000-windows-machines,"Crypto-Mining Botnet Ensnares 500,000 Windows Machines","Focused on mining Monero crypto-currency, a new botnet has managed to ensnare over half a million machines to date, most of which are believed to be servers.  [Read More]"
https://www.securityweek.com/mami-mac-malware-hijacks-dns-settings,'MaMi' Mac Malware Hijacks DNS Settings,"MaMi is a new piece of malware designed to hijack DNS settings on infected macOS machines. Other capabilities present, but not active  [Read More]"
https://www.securityweek.com/mac-malware-creator-indicted-us,Mac Malware Creator Indicted in U.S.,An Ohio man was charged this week in a 16-count indictment for allegedly developing malware known as “FruitFly” and for infecting thousands of computers with it.  [Read More]
https://www.securityweek.com/avast-open-sources-machine-code-decompiler-battle-against-malware,Avast Open Sources Machine-Code Decompiler in Battle Against Malware,"In an effort to boost the fight against malicious software, anti-malware company Avast this week announced the release of its retargetable machine-code decompiler as open source.  [Read More]"
https://www.securityweek.com/macos-backdoor-uses-innovative-disguise-technique,macOS Backdoor Uses Innovative Disguise Technique,macOS-targeting HiddenLotus backdoor is using an innovative technique to disguise the fact that it is an executable in order to avoid alerting users on its execution.  [Read More]
https://www.securityweek.com/macos-malware-spread-fake-symantec-blog,macOS Malware Spread Via Fake Symantec Blog,A newly observed variant of the macOS-targeting Proton malware is spreading through a blog spoofing that of legitimate security company Symantec.  [Read More]
https://www.securityweek.com/supply-chain-attack-spreads-macos-rat,Supply Chain Attack Spreads macOS RAT,Hackers breach Eltima website and use it to deliver macOS RAT Proton via a trojanized version of Elmedia Player  [Read More]
https://www.securityweek.com/ursnif-trojan-uses-new-malicious-macro-tactics,Ursnif Trojan Uses New Malicious Macro Tactics,Recently observed distribution campaigns featuring the Ursnif banking Trojan were using new malicious macro tactics for payload delivery  [Read More]
https://www.securityweek.com/wikileaks-details-mac-os-x-hacking-tools-used-cia,WikiLeaks Details Mac OS X Hacking Tools Used by CIA,WikiLeaks publishes documents describing three tools used by the CIA to hack OS X and other POSIX systems  [Read More]
https://www.securityweek.com/georgian-news-site-serves-new-version-old-mac-trojan,Georgian News Site Serves New Version of Old Mac Trojan,A news website in Georgia delivers a new version of the old Mac Trojan dubbed Leverage to Safari users  [Read More]
https://www.securityweek.com/macspy-malware-offered-free-service,MacSpy Malware Offered as Free Service,"Hot on the heels of MacRansom Ransomware-as-a-service (RaaS) comes the first malware-as-a-service (MaaS) targeting Mac users, offered for prices starting as low as free, AlienVault reveals.  [Read More]"
https://www.securityweek.com/macransom-raas-potentially-created-copycats,MacRansom RaaS Potentially Created by Copycats,"MacRansom is a newly discovered ransomware family targeting Mac users is using the Ransomware-as-a-service (RaaS) distribution model and uses code copied from previous MacOS ransomware, Fortinet researchers warn.  [Read More]"
https://www.securityweek.com/mouseover-macro-campaign-delivers-gootkit-trojan-powerpoint,Mouseover Macro Campaign Delivers Gootkit Trojan Via PowerPoint,Trend Micro has published details on a spam campaign it detected in late May that delivers malware by using PowerPoint files and mouseover events.  [Read More]
https://www.securityweek.com/software-download-mirror-distributes-mac-malware,Software Download Mirror Distributes Mac Malware,A download mirror for the video converting tool HandBrake was recently compromised and configured to distribute a remote administration Trojan (RAT) for Mac computers.  [Read More]
https://www.securityweek.com/cerber-ransomware-tries-evade-machine-learning-security,Cerber Ransomware Tries to Evade Machine Learning Security,The Cerber ransomware is using new evasion techniques designed elude machine learning security solutions.  [Read More]
https://www.securityweek.com/weaponized-word-document-targets-macos-windows,"Weaponized Word Document Targets macOS, Windows",Cybercriminals have been using a macro-enabled Word document that can be used to infect both macOS and Windows machines with malware.  [Read More]
https://www.securityweek.com/decryption-tool-released-findzip-macos-ransomware,Decryption Tool Released for FindZip macOS Ransomware,macOS users who had their systems infected with the FindZip ransomware can now use a decryption tool to restore their files without paying the ransom.  [Read More]
https://www.securityweek.com/macos-rat-uses-0-day-root-access,macOS RAT Uses 0-Day for Root Access,A new remote access tool (RAT) targeting macOS machines currently advertised on underground markets is believed to be using an unpatched 0-day vulnerability to gain root access on target machines.  [Read More]
https://www.securityweek.com/new-filecoder-macos-ransomware-surfaces,"New ""Filecoder"" macOS Ransomware Surfaces",Filecoder is a newly discovered ransomware targeting macOS that destroys encryption keys before sending them to its apparently inexperienced developer.  [Read More]
https://www.securityweek.com/office-loader-uses-macros-drop-array-malware,Office Loader Uses Macros to Drop Array of Malware,"A recently discovered Microsoft Office loader uses malicious macros to drop multiple malware families, Palo Alto Networks security researchers warn.  [Read More]"
https://www.securityweek.com/macro-malware-comes-macos,Macro Malware Comes to macOS,Malware that abuses macro-enabled Microsoft Office documents to spread is now targeting macOS users too.  [Read More]
https://www.securityweek.com/new-quimitchin-mac-malware-emerges-targeting-scientific-research,"New ""Quimitchin"" Mac Malware Emerges Targeting Scientific Research","Newly discovered Quimitchin malware has been found infecting Mac OS X systems, in what security experts consider to be ""the first Mac malware of 2017.""  [Read More]"
https://www.securityweek.com/mac-crashing-malware-distributed-tech-support-scam,Mac Crashing Attack Method Used in Tech Support Scam,Malware designed to crash Mac OS machines is being delivered through drive-by downloads as part of a campaign designed to trick users into calling a fake tech support service.  [Read More]
https://www.securityweek.com/killdisk-malware-targets-linux-machines,KillDisk Malware Targets Linux Machines,"The destructive KillDisk malware previously associated with attacks targeting industrial firms, was recently observed infecting Linux machines as well, ESET security researchers warn.  [Read More]"
https://www.securityweek.com/nymaim-trojan-uses-mac-addresses-bypass-virtualization,Nymaim Trojan Fingerprints MAC Addresses to Bypass Virtualization,"The Nymaim Trojan is now fingerprinting MAC addresses and comparing the targeted machine’s MAC address against a hardcoded list, which allows it to avoid virtual environments and thwart analysis tools.  [Read More]"
https://www.securityweek.com/mac-os-malware-web-based-threats-decline-report,"Mac OS Malware, Web-based Threats Decline: Report","According McAfee, new malware samples in Q2 2016 totaled more than 40 million, which is the second highest quarterly figure ever recorded.  [Read More]"
https://www.securityweek.com/locky-ransomware-reverts-malicious-macros,Locky Ransomware Reverts to Malicious Macros,"The Locky ransomware has switched back to the distribution method of Office documents with malicious macros, FireEye researchers warn.  [Read More]"
https://www.securityweek.com/attackers-disguise-macro-malware-renaming-files,Attackers Disguise Macro Malware by Renaming Files,"Malware operators can hide the use of malicious macros to distribute malware by simply renaming the offending Office documents, Cisco researchers reveal.  [Read More]"
https://www.securityweek.com/hunting-snark-machine-learning-artificial-intelligence-and-cognitive-computing,"Hunting the Snark with Machine Learning, Artificial Intelligence, and Cognitive Computing","New developments in machine learning (ML), artificial intelligence (AI), and cognitive computing (CC) can play an important role in cyber security.  [Read More]"
https://www.securityweek.com/new-os-x-backdoor-steals-mac-keychain-content,New OS X Backdoor Steals Mac Keychain Content,"A new Mac OS X piece of malware was designed to steal the content of the keychain and to establish permanent backdoor access to the infected system, ESET security researchers warn.  [Read More]"
https://www.securityweek.com/os-x-backdoor-provides-unfettered-access-mac-systems,OS X Backdoor Provides Unfettered Access to Mac Systems,Malware that masquerades as legitimate software application called EasyDoc Converter is actually a malicious backdoor that provides attackers with full access to a compromised Mac system.  [Read More]
https://www.securityweek.com/attacks-against-banks-leverage-macros-powershell,"Attacks Against Banks Leverage Macros, PowerShell","A series of attacks carried out against banks in the Middle East in early May were using Macros and unique PowerShell scripts that are not commonly seen in crimeware campaigns, researchers at FireEye warn.  [Read More]"
https://www.securityweek.com/macro-malware-makes-improvements-hiding-malicious-code,Macro Malware Makes Improvements on Hiding Malicious Code,"Macro malware has recently returned to focus and is evolving, courtesy of tricks designed to better keep the malicious code hidden, Microsoft warns.  [Read More]"
https://www.securityweek.com/powerware-ransomware-abuses-powershell-office-macros,"PowerWare Ransomware Abuses PowerShell, Office Macros","A new fileless ransomware family has been discovered, which abuses Windows’ PowerShell for nefarious activities, a novel approach to ransomware, Carbon Black researchers warn.  [Read More]"
https://www.securityweek.com/powersniff-malware-attacks-abuse-macros-powershell,"PowerSniff Malware Attacks Abuse Macros, PowerShell",A new piece of malware dubbed PowerSniff abuses macros and PowerShell in semi-targeted attacks aimed at the U.S. and Europe  [Read More]
https://www.securityweek.com/macro-malware-dridex-locky-using-forms-hide-code,"Macro Malware Dridex, Locky Using Forms to Hide Code",Dridex and Locky macro malware families are now using Form object in macros to obfuscate their malicious code.  [Read More]
https://www.securityweek.com/macro-malware-has-returned-intel-security,Macro Malware Has Returned: Intel Security,"Macro malware, one of the most successful threats in the 1990s, has returned to focus in the form of persistent threats targeting organizations, Intel Security reports.  [Read More]"
https://www.securityweek.com/mac-os-x-and-ios-infections-and-threats-rise-symantec,Mac OS X and iOS Infections and Threats on the Rise: Symantec,"The number of Mac OS X systems infected with malware during the first nine months of 2015 is seven times higher than in all of 2014, Symantec reports.  [Read More]"
https://www.securityweek.com/vawtrak-banking-trojan-uses-windows-powershell-macros-infection-routines,"Vawtrak Banking Trojan Uses Windows PowerShell, Macros in Infection Routines","The Vawtrak banking malware now leverages macros and the Windows PowerShell scripting tool to infect computers, Trend Micro reported on Monday.  [Read More]"
https://www.securityweek.com/googles-santa-tracks-naughty-and-nice-binaries-mac-os-x,"Google's ""Santa"" Tracks Naughty and Nice Binaries on Mac OS X","Google's Macintosh Operations Team announced last week the availability of the source code for ""Santa,"" a tool designed for whitelisting and blacklisting binaries on Apple's Mac OS X operating systems.  [Read More]"
https://www.securityweek.com/cybercriminals-use-macros-deliver-rovnix-malware,Cybercriminals Use Macros to Deliver Rovnix Malware,"The Rovnix Trojan has started leveraging macros embedded in innocent-looking Microsoft Word documents to infect computers, researchers at Trend Micro reported.  [Read More]"
https://www.securityweek.com/feedback-friday-wirelurker-malware-targets-mac-os-x-ios-industry-reactions,"Feedback Friday: WireLurker Malware Targets Mac OS X, iOS - Industry Reactions",Researchers at Palo Alto Networks identified a piece of malware called WireLurker that was designed to target Mac OS X and iOS users. Experts believe WireLurker once again shows that Apple devices are not immune to malware.  [Read More]
https://www.securityweek.com/new-wirelurker-malware-targets-ios-mac-os-x-users-trojanized-applications,"New ""WireLurker"" Malware Targets iOS, Mac OS X Users via Trojanized Applications",Researchers at Palo Alto Networks have uncovered a new piece of malware designed to target devices running Apple's OS X and iOS operating systems and might have been installed by hundreds of thousands of users.  [Read More]
https://www.securityweek.com/new-mac-os-x-botnet-taps-reddit-command-and-control,New Mac OS X Botnet Taps Reddit For Command and Control,A new piece of malware (Mac.BackDoor.iWorm) has infected thousands of Mac OS X devices and uses Reddit to get a list of command and control (C&C) servers.  [Read More]
https://www.securityweek.com/windows-backdoor-ported-mac-os-x-used-targeted-attacks,"Windows Backdoor Ported to Mac OS X, Used in Targeted Attacks","A Windows backdoor used in numerous attacks by a certain threat group has been ported to Mac OS X and fitted with new features, researchers at FireEye reported.  [Read More]"
https://www.securityweek.com/triumfant-unveils-mac-endpoint-security-monitoring-agent,Triumfant Unveils Mac Endpoint Security Monitoring Agent,Triumfant's new endpoint security agent for Mac OS provides real-time detection and automatic remediation of malware and other sophisticated attacks occurring in-memory or on a hard drive.  [Read More]
https://www.securityweek.com/virustotal-launches-uploader-utility-mac-os-x,VirusTotal Launches Uploader Utility for Mac OS X,"VirusTotal, the popular service that lets users analyze suspicious files and URLs to help facilitate the detection of malware, has launched a Mac OS X version of its VirusTotal Uploader utility.  [Read More]"
https://www.securityweek.com/intego-updates-mac-security-products,Intego Updates Mac Security Products,"Intego, a provider of security products designed exclusively for Mac OS, introduced its latest product line, including VirusBarrier X8 and NetBarrier X8.  [Read More]"
https://www.securityweek.com/cross-platform-java-bot-launches-ddos-attacks-windows-mac-and-linux-machines,"Cross Platform 'Java-bot' Launches DDoS Attacks from Windows, Mac and Linux Machines","Researchers from Kaspersky Lab have uncovered a new malware that has the ability to infect systems running Windows, Mac OS X, and Linux and launch DDoS attacks from any infected devices.  [Read More]"
https://www.securityweek.com/bit9-launches-enterprise-class-threat-protection-solution-mac,Bit9 Launches Enterprise-class Threat Protection Solution for Mac,"Bit9, announced an enterprise-class security solution for Mac OS X that continuously monitors and records all activity on desktops, laptops and servers while working to stop targeted and advanced attacks.  [Read More]"
https://www.securityweek.com/malicious-mac-os-x-backdoor-signed-valid-developer-id-found-activists-computer,Malicious Mac OS X Backdoor Signed With Valid Developer ID Found on Activist's Computer,Researchers found malware which acts as a backdoor for Mac OS X on a computer belonging to an activist attending the Oslo Freedom Forum this week.  [Read More]
https://www.securityweek.com/windows-trojan-found-targeting-mac-os-x-users,Windows Trojan Found Targeting Mac OS X Users,"Researchers at ESET have discovered a Trojan that initially focused on Windows users, but appears to be changing direction and now targeting Mac OS X users.  [Read More]"
https://www.securityweek.com/south-korea-cyber-attacks-used-data-wiping-trojan-component-wipe-linux-machines,"South Korea Cyber Attacks Used Data-Wiping Trojan, Component to Wipe Linux Machines","While the motivation for the recent cyber-attacks against Korean organizations remains unclear, researchers have identified the malware used as a data-wiping Trojan.  [Read More]"
https://www.securityweek.com/new-mac-malware-offers-pint-sized-problem,New Mac Malware Offers 'Pint-sized' Problem,"Mac security firm Intego has discovered a new type of malware for OS X, which will pose a bit of a problem when it comes to protection, given its use of Open SSH.  [Read More]"
https://www.securityweek.com/new-malware-campaign-targets-uyghur-activists-mac-os-x,New Malware Campaign Targets Uyghur Activists On Mac OS X,"Researchers have observed a recent spike in attacks against the Uyghur community to monitor their email and chat activities, according AlientVault and Kaspersky Lab.  [Read More]"
https://www.securityweek.com/new-mac-malware-variant-targeting-tibetan-activists,New Mac Malware Variant Targeting Tibetan Activists,"Tibetan activists are being targeted by a new variant of the Imuler (Revir) Trojan that was discovered in September. The attack is launched via email, and uses images of other pro-Tibetan groups as bait in order to encourage the victim into opening files.  [Read More]"
