Link,Title,Intro
https://www.securityweek.com/newest-mac-malware-snatching-passwords,Newest Mac Malware is Snatching Passwords,"Anti-Virus firm Dr. Web has discovered another family of Mac-based malware that targets passwords. In addition to Mac OS X, this malware also targets Linux installations.  [Read More]"
https://www.securityweek.com/crisis-malware-able-hijack-virtual-machines,Crisis Malware Able to Hijack Virtual Machines,"Symantec malware researchers discovered that the JAR file that is used by Crisis to infect a given system has an additional payload for Windows, and may be the first malware that attempts to spread onto a virtual machine.  [Read More]"
https://www.securityweek.com/crowdstrike-adds-sharing-controls-maclinux-support-reverse-engineering-platform,"CrowdStrike Adds Sharing Controls, Mac/Linux Support to Reverse Engineering Platform","New features in the Alpha++ release of CrowdRE include Linux and Mac versions of the plugin, as well as granular sharing controls and ""Karma"" ratings within the platform.  [Read More]"
https://www.securityweek.com/report-examines-code-behind-crisis-trojan-targeting-mac-os-x,Report Examines Code Behind Crisis Trojan Targeting Mac OS X,"ThreatMetrix, published a report on the Crisis Trojan that breaks the code down, and examines the internals of the latest threat targeting Mac OS X users.  [Read More]"
https://www.securityweek.com/latest-mac-malware-was-just-waiting-be-found,Latest Mac Malware Was Just Waiting to be Found,"On Tuesday, a new type of malware was discovered that targets Apple’s Mac OS X. Called Crisis, the Trojan creates a backdoor on an infected Mac as long as it runs OS X version 10.6 or 10.7.  [Read More]"
https://www.securityweek.com/multi-platform-java-exploit-targets-macs-linux-windows,"Multi-Platform Java Exploit Targets Macs, Linux, Windows","If allowed to run, a malicious Java applet checks the user's operating system and delivers a payload customized for that platform, whether it's Windows, Mac OS X, or Linux.  [Read More]"
https://www.securityweek.com/new-mac-os-x-backdoor-found-targeting-uyghur-activists,New Mac OS X Backdoor Found Targeting Uyghur Activists,Researchers from Russian security firm Kaspersky Lab today said they have discovered a new APT campaign that is using a new Mac OS X backdoor variant targeted at Uyghur activists.  [Read More]
https://www.securityweek.com/adobe-offer-silent-updates-mac-os-and-protection-firefox,Adobe to Offer Silent Updates for Mac OS and Protection on Firefox,"Version 11.3 of Adobe’s Flash Player, due in June, will provide the same silent update feature currently available to Windows users to those running OS X. In addition, Adobe will also offer a new security enhancement to Firefox called protected mode.  [Read More]"
https://www.securityweek.com/microsoft-mac-malware-targeting-flaw-patched-three-years-ago,Microsoft: Mac Malware Targeting Flaw Patched Three Years Ago,"Microsoft researchers have discovered new malware targeting the Mac, but unlike Flashback, this one is targeting a flaw in Office for Mac that was patched years ago.  [Read More]"
https://www.securityweek.com/kaspersky-confirms-new-mac-trojan-used-targeted-attacks,Kaspersky Confirms New Mac Trojan Used for Targeted Attacks,"Once SabPub is installed on a Mac, it will connect to a C&C and wait for instructions. To have a look at what happens after, Kaspersky installed SabPub on a test system and let it run.  [Read More]"
https://www.securityweek.com/mac-malware-linked-luckycat-attack-campaign,Mac Malware Linked to 'Luckycat' Attack Campaign,"The malware, known as SabPub, has been spotted spreading through malicious Microsoft Word documents exploiting the same Java vulnerability targeted by the now-notorious Flashback Trojan.  [Read More]"
https://www.securityweek.com/security-companies-release-freeware-fight-mac-flashback-trojan,Security Companies Release Freeware to Fight Mac Flashback Trojan,Security researchers at Kaspersky Lab and Intego have released free tools to help Mac users infected with the Flashback Trojan clean their computers.  [Read More]
https://www.securityweek.com/mac-os-x-malware-builds-botnet-more-550000-strong,"Mac OS X Malware Builds Botnet More than 550,000 Strong","Security researchers say the Flashback malware hitting Mac OS X machines has built a powerful botnet of more than 550,000 computers.  [Read More]"
https://www.securityweek.com/java-flaw-mac-os-x-actively-exploited,Flashback Malware Evolves Again: Java Flaw in Mac OS X Actively Exploited,"If exploited, the Mac malware could drop additional malicious payloads, or modify targeted websites in order to bombard a user with annoying ads – which earn money for the attackers.  [Read More]"
https://www.securityweek.com/targeted-attacks-against-tibet-using-ms-office-exploit-deliver-mac-control-rat,"Targeted Attacks Against Tibet Using MS Office Exploit to Deliver ""Mac Control"" RAT","The Trojan, named “Mac Control” by its authors, executes when the system starts, and will established a connection to the C&C in order to wait for commands. Investigation into the malware itself shows it has the ability to allow remote shells, as well as the ability to send, receive, and delete files.  [Read More]"
https://www.securityweek.com/malware-mac-targeting-passwords-and-crashing-applications,Malware for Mac Targeting Passwords and Crashing Applications,"On Friday, Intego reported that a new variant of Flashback is targeting passwords and as a byproduct of infection, Flashback is crashing several notable applications.  [Read More]"
https://www.securityweek.com/mac-os-x-trojan-targeting-apple%E2%80%99s-anti-malware-system,Mac OS X Trojan Targeting Apple’s Anti-Malware System,"A Trojan targeting Mac OS X, named Flashback by some vendors, is disabling the XProtect component of Apple’s operating system. The latest variant of the Fashback will disable XProtect’s automatic update features, preventing new detections from being installed to the infected host.  [Read More]"
https://www.securityweek.com/windows-vs-mac-os-whos-better-protected-against-apts,Windows vs. Mac OS: Who's Better Protected Against APTs?,"The specter of advanced persistent threats (APTs) hangs over a growing number of conversations these days about enterprise security, and has prompted businesses to take a closer look at how they can make their environments less vulnerable. For some, this has reignited discussions about how the security of Apple’s Mac OS X stacks up against Microsoft Windows.  [Read More]"
https://www.securityweek.com/avg-offers-web-security-product-mac,AVG Offers Web Security Product for the Mac,AVG Technologies today announced an offering for Mac lovers. AVG LinkScanner for Mac...  [Read More]
https://www.securityweek.com/mac-randomization-flaws-expose-phones-tracking,MAC Randomization Flaws Expose Phones to Tracking,New attack method can be used to track mobile devices that rely on MAC address randomization to protect privacy  [Read More]
/vinfo/us/threat-encyclopedia/spam/656/fake-bank-notification-spam-arrives-with-macro-malware\,Fake Bank Notification Spam Arrives With Macro Malware,"Another fake bank notification spam has been spotted by our engineers and the sample we caught is a typical example of such email-based threats. The body of the letter, designed to mimic an official notification from a very popular bank in Britain, urgently tells the reader to check the attached file in order to verify 'terms and conditions', most likely for the purpose of a business transaction.Read more   "
/vinfo/us/threat-encyclopedia/spam/632/fake-ikea-purchase-order-email-comes-with-malicious-macro-attachment,Fake IKEA Purchase Order Email Comes With Malicious Macro Attachment,"We recently encountered a spam sample that purports itself to be a purchase order from IKEA, which is a famous furniture retailer founded in Sweden and features modern Scandanavian furniture. However, once unsuspecting users or legitimate IKEA customers open the attached .Read more   "
/vinfo/us/threat-encyclopedia/spam/572/fake-antivirus-knowledgebase-spam-leads-to-pharmacy-website-peddling-viagra\,Fake Antivirus Knowledgebase Spam Leads To Pharmacy Website Peddling Viagra,"Users may find e-mails coming from a known antivirus company nothing to be surprised about, but alarms should definitely start ringing when the antivirus company mailing you isn't the one you're subscribed to - and that their mails are festooned with links to websites peddling Viagra.Our team of engineers recently found a spam mail making the rounds, masking itself as a legit mail coming from CA Technologies.Read more   "
/vinfo/us/threat-encyclopedia/spam/3529/fake-family-doctors-recommend-fake-online-pharmacy-via-vcards,Fake Family Doctors Recommend Fake Online Pharmacy via vCards,"In a bid to get users to click, cybercriminals turn to your trusted persons. We have seen spammed messages with vCard attachments, electronic business cards that contain personal information of a person such as name, address, phone number, email address, website and even audio clips.Read more   "
/vinfo/us/threat-encyclopedia/spam/3504/fake-social-networking-notifications-lead-to-pharmaceutical-websites\,Fake Social Networking Notifications Lead To Pharmaceutical Websites,"Pharmaceutical spam isn't necessarily a malicious type of spam, but there exists the potential for them to lead to malicious or scam sites, so we always advise users to keep clear of them. This time is no different, as we spotted a new batch of samples that purported themselves to be urgent notifications from sites of general interest, such as Facebook, Youtube and Instagram.Read more   "
/vinfo/us/threat-encyclopedia/spam/492/fake-notification-spam-from-social-networking-sites-itunes-lead-to-online-pharmacy,"Fake Notification Spam  From Social Networking Sites, iTunes Lead To Online Pharmacy","Cybercriminals will always capitalize on the popular and the trusted, and this latest pharmacy spam campaign is no exception. In fact, it proves the theory in spades, as not only does it spoof popular social networking website email notifications such as Facebook and Instagram, it also spoofs iTunes, Google and Fedex! The mails, while obviously different in terms of which website they're spoofing, all link to the same online pharmacy website, one that seems to specialize in performance enhancement drugs.Read more   "
/vinfo/us/threat-encyclopedia/spam/261/spammed-linkedin-and-myspace-fake-confirmation-mails-direct-to-wikipharmacy\,Spammed LinkedIn and MySpace Fake Confirmation Mails Direct to WikiPharmacy,Trend Micro researchers spotted another spammed email messages purporting to be from popular social networking sites LinkedIn and MySpace. The mail from LinkedIn asks the users to click on a provided link in order to confirm their email address.Read more   
/vinfo/us/threat-encyclopedia/spam/268/online-pharmacy-campaign-leverages-google\,Online Pharmacy Campaign Leverages Google,A spammed message promoting something called the Google Accredited Pharmacy is seen in the wild. The said email message contains an image that shows a link.Read more   
/vinfo/us/threat-encyclopedia/spam/251/fake-pharmacy-site-special-offers-this-valentine,Fake Pharmacy Site Special Offers This Valentine,"With Valentine's Day just around the corner, spammers are leveraging this event to lure users into fake online pharmacy websites. The bogus sites promote Valentine's day special offers on pharmacy-related products.Read more   "
/vinfo/us/threat-encyclopedia/spam/254/numerous-pharmaceutical-spam-in-english-and-french-in-the-wild\,Numerous Pharmaceutical Spam In English and French In the Wild,Trend Micro uncovered bulk samples of spam that sell pharmaceutical products. The message is written in both French and English.Read more   
/vinfo/us/threat-encyclopedia/spam/225/spammers-use-thanksgiving-to-promote-fake-pharmacy-site,Spammers Use Thanksgiving to Promote Fake Pharmacy Site,"Holiday-themed threats are a staple in today's threat landscape. In particular, users should be on the lookout for spammed messages that leverage popular events.Read more   "
/vinfo/us/threat-encyclopedia/spam/201/spam-leads-to-wikipharmacy,Spam Leads to Wikipharmacy,"Spammers are now leveraging popular website, Wikipedia to point users to pharmacy sites. TrendLabs engineers spotted spammed messages in plain text that contained a URL.Read more   "
/vinfo/us/threat-encyclopedia/spam/208/memorial-day-spam-leads-to-online-pharmacy-site,Memorial Day Spam Leads to Online Pharmacy Site,"Cybercriminals always capitalize on current events as well as holidays. Just recently, TrendLabs researchers spotted spammed messages that bore the subject, 'Delivery within USA 2-3 day !!.Read more   "
https://www.securityweek.com/macos-bug-allows-root-access-no-password,macOS Bug Allows Root Access With No Password,An easy-to-exploit bug in macOS High Sierra allows root access to a machine without needing a password and it’s remotely exploitable  [Read More]
https://www.securityweek.com/firms-increasingly-turn-machine-learning-security-solutions,Firms Increasingly Turn to Machine Learning for Security Solutions,"Organizations are increasingly turning to machine learning for security solutions, according to a new study commissioned by Cylance  [Read More]"
https://www.securityweek.com/apple-silently-patched-macos-security-bypass-flaw,Apple Silently Patched macOS Security Bypass Flaw,Researchers claim Apple silently patched a macOS vulnerability that can be exploited to bypass quarantine and execute JavaScript code  [Read More]
https://www.securityweek.com/unsigned-apps-can-steal-macos-keychain-passwords,Unsigned Apps Can Steal macOS Keychain Passwords,"Unsigned apps can steal passwords from the macOS keychain, researcher warns. Issue affects several versions of OS, including High Sierra  [Read More]"
https://www.securityweek.com/amazon-launches-aws-data-protection-service,Amazon Unveils Machine Learning Security Service,"Amazon launches Macie, a new service that helps AWS users discover, classify and protect sensitive data  [Read More]"
https://www.securityweek.com/man-machine-teamwork-needed-effective-threat-hunting-report,Man-Machine Teamwork Needed for Effective Threat Hunting: Report,"Effective threat hunting leading to efficient incident response is a combination of man and machine, of art and science, with the man tailoring and automating the science to suit his own environment.  [Read More]"
https://www.securityweek.com/apple-cias-mac-iphone-vulnerabilities-already-patched,"Apple: CIA's Mac, iPhone Vulnerabilities Already Patched","Apple’s initial analysis shows that the iPhone and Mac exploits disclosed by WikiLeaks have already been patched, and the company told WikiLeaks to submit vulnerabilities through the normal process  [Read More]"
https://www.securityweek.com/sophos-launches-full-disk-encryption-mac,Sophos Launches Full Disk Encryption for Mac,"Full Disk Encryption for Mac - Sophos has dished out a new data encryption tool for users of MacBooks and Macs, allowing them to protect their data against theft of private and official information.  [Read More]"
https://www.securityweek.com/apple-fixes-indian-character-crash-bug-ios-macos,"Apple Fixes Indian Character Crash Bug in iOS, macOS",Apple updates iOS and macOS to patch flaw that causes devices to crash when displaying certain strings of Indian characters  [Read More]
https://www.securityweek.com/patch-macos-root-access-flaw-breaks-file-sharing,Patch for macOS Root Access Flaw Breaks File Sharing,Apple’s patch for the recently disclosed root access vulnerability affecting macOS High Sierra breaks file sharing functionality. Quick fix provided  [Read More]
https://www.securityweek.com/apple-patches-critical-root-access-flaw-macos,Apple Patches Critical Root Access Flaw in macOS,Apple rushes to patch critical macOS High Sierra vulnerability that can be exploited to gain root access to a system  [Read More]
https://www.securityweek.com/how-machine-learning-will-help-attackers,How Machine Learning Will Help Attackers,Adversaries will use machine learning techniques to develop strategies to disrupt defenses and as a tool to make their attacks more effective.  [Read More]
https://www.securityweek.com/attacker-uses-virtual-machine-hide-malicious-activity,Attacker Uses Virtual Machine to Hide Malicious Activity,Cybercriminals are using virtual machines (VMs) to hide their nefarious activity on compromised systems.  [Read More]
https://www.securityweek.com/tibcos-loglogic-55-taps-machine-data-improved-intelligence,TIBCO's LogLogic 5.5 Taps Machine Data for Improved Intelligence,"TIBCO's LogLogic 5.5 provides IT businesses control with a centralized source for enterprise log and machine data, improving business agility and achieving cost savings.  [Read More]"
https://www.securityweek.com/content/updated-digital-forensics-suite-mac-released,Updated Digital Forensic Suite for Mac Released,"Updated Digital Forensic Suite Features Improved Performance, Enhanced User Interface, and Support for Snow Leopard  [Read More]"
https://www.securityweek.com/smartphones-replace-cards-bank-machines,Smartphones to Replace Cards at Bank Machines,"Cardless automatic teller machines (ATMs) are gaining ground in the US and around the world, with smartphone technology allowing for speedier and more secure transactions.  [Read More]"
https://www.securityweek.com/macate-unveils-new-security-focused-cyberphone,"Macate Unveils New Security-Focused ""Cyberphone""","Silicon Valley-based Macate unveiled GATCA Elite cyberphone, a security-focused smartphone that combines advanced security and encryption features.  [Read More]"
https://www.securityweek.com/david-kleidermacher-appointed-chief-security-officer-blackberry,David Kleidermacher Appointed Chief Security Officer at BlackBerry,"BlackBerry has appointed David Kleidermacher as its new chief security officer, the smartphone maker announced on Tuesday.  [Read More]"
https://www.securityweek.com/bug-tor-browser-exposed-ip-addresses-macos-and-linux-users,Bug in Tor Browser Exposed IP Addresses of macOS and Linux Users,A critical vulnerability (CVE-2017-16541) that could reveal a Tor user’s IP address was addressed over the weekend in the privacy-focused web browser.  [Read More]
https://www.securityweek.com/backdoor-found-skype-mac,Backdoor Found in Skype for Mac,Authentication bypass flaw in Skype for Mac could have been exploited by malware to interact with the app  [Read More]
https://www.securityweek.com/shazam-mac-keeps-listening-even-when-disabled,Shazam for Mac Keeps Listening Even When Disabled,The Mac version of the Shazam music discovery app keeps the device’s microphone on even when it’s turned off  [Read More]
https://www.securityweek.com/schneider-patches-flaws-vampset-somachine-products,"Schneider Patches Flaws in VAMPSET, SoMachine Products","Schneider Electric patches vulnerabilities, including ones rated high severity, in VAMPSET and SoMachine HVAC products  [Read More]"
https://www.securityweek.com/ge-machine-monitoring-system-plagued-serious-flaw,GE Machine Monitoring System Plagued by Serious Flaw,Remote hackers can hijack GE Bently Nevada machine monitoring systems through a critical vulnerability  [Read More]
https://www.securityweek.com/parallels-desktop-mac-feature-allows-guest-host-vm-escape,Parallels Desktop for Mac Feature Allows Guest-to-Host VM Escape,An integration feature that allows Parallels Desktop users to access Windows folders from Mac OS X operating systems can exploited for a guest-to-host virtual machine (VM) escape.  [Read More]
https://www.securityweek.com/microsoft-launches-antimalware-azure-cloud-services-and-virtual-machines,Microsoft Launches Antimalware for Azure Cloud Services and Virtual Machines,Microsoft Azure customers can now add an extra layer of security to their cloud services and virtual machines (VMs) at no extra cost by using Microsoft Antimalware.  [Read More]
https://www.securityweek.com/vupen-method-breaks-out-virtual-machine-attack-hosts,VUPEN Method Breaks Out of Virtual Machine to Attack Hosts,"Researchers developed an ""advanced exploitation method"" which triggered a previously discovered vulnerability in order to escape a Xen virtual machine running on Citrix XenServer and get onto the host machine.  [Read More]"
https://www.securityweek.com/macbooks-leak-disk-encryption-password,MacBooks Leak Disk Encryption Password,Apple fixes vulnerability that can be exploited to obtain the disk encryption password of a MacBook using a $300 Thunderbolt device  [Read More]
https://www.securityweek.com/centrify-expands-iam-support-macs-apple-watch,"Centrify Expands IAM Support for Mac, Apple Watch","Centrify has unveiled expanded support for Mac OS X computers, the recently released Apple Watch, and Near Field Communication (NFC).  [Read More]"
https://www.securityweek.com/macos-high-sierra-update-patches-keychain-access-flaw,macOS High Sierra Update Patches Keychain Access Flaw,An update released by Apple for macOS High Sierra patches a vulnerability that can be exploited to steal passwords from the keychain  [Read More]
https://www.securityweek.com/macos-high-sierra-leaks-apfs-volume-passwords-hint,macOS High Sierra Leaks APFS Volume Passwords via Hint,macOS High Sierra leaks the password for APFS volumes via the password hint  [Read More]
https://www.securityweek.com/nsa-eyes-encryption-breaking-quantum-machine-report,NSA Eyes Encryption-breaking 'Quantum' Machine: Report,"The NSA is making strides toward building a ""quantum computer"" that could break nearly any kind of encryption, according to documents leaked by Edward Snowden.  [Read More]"
https://www.securityweek.com/devicelock-extends-dlp-solution-mac-os-x,DeviceLock Extends DLP Solution to Mac OS X,"DeviceLock released DeviceLock Endpoint DLP Suite version 7.3, a new version that extends support to Mac OS X-based computers.  [Read More]"
https://www.securityweek.com/safend-adds-data-protection-ipads-iphones-and-macs-enterprise,"Safend Adds Data Protection for iPads, iPhones and Macs in the Enterprise","Data Protection for iPads, iPhones and Macs in the Enterprise  [Read More]"
https://www.securityweek.com/red-team-vs-blue-team-using-machine-learning,Using Machine Learning for Red Team Vs Blue Team Wargames,"Cybersecurity firm Endgame believes that defenders need to accept the methods of the modern adversary (the stealthy attack), and adapt as required.  [Read More]"
https://www.securityweek.com/linux-machines-powered-nearly-half-ddos-attacks-q3-kaspersky,Linux Machines Powered Nearly Half of DDoS Attacks in Q3: Kaspersky,"DDoS attacks from Linux-based botnets accounted for 45.6 percent of the total DDoS attacks in Q3 2015, with most notable being the XOR DDoS botnet,  [Read More]"
https://www.securityweek.com/fireeye-launches-threat-protection-mac-os-x-ios,"FireEye Launches Threat Protection for Mac OS X, iOS",Threat protection firm FireEye has announced new targeted attack protection offering for Apple’s Mac OS X and iOS platforms.  [Read More]
https://www.securityweek.com/sophos-blackhole-will-get-more-complex-android-and-mac-os-are-prime-attack-targets,"Sophos: BlackHole Will Get More Complex, Android and Mac OS Are Prime Attack Targets","2012 was a year of new platforms and modern malware—what was once a homogeneous world of Windows systems, is now a landscape made up of diverse platforms, Sophos said in its Security Threat Report 2013.  [Read More]"
https://www.securityweek.com/flaw-eset-antivirus-mac-allowed-code-execution,Flaw in ESET Antivirus for Mac Allowed Code Execution,Google researchers find critical remote code execution vulnerability in ESET Endpoint Antivirus for macOS  [Read More]
https://www.securityweek.com/macos-high-sierra-logs-external-volume-passwords-plaintext,macOS High Sierra Logs External Volume Passwords in Plaintext,"In macOS High Sierra, the passwords used for Apple File System (APFS)-encrypted external drives are logged and kept in on-disk log files, a security researcher has discovered.  [Read More]"
https://www.securityweek.com/apple-patches-meltdown-flaw-older-versions-macos,Apple Patches Meltdown Flaw in Older Versions of macOS,"Apple releases security updates for iOS, macOS and other products, including Meltdown patches for older versions of macOS/OS X  [Read More]"
https://www.securityweek.com/bogus-passwords-can-unlock-appstore-preferences-macos,Bogus Passwords Can Unlock AppStore Preferences in macOS,A security vulnerability impacting macOS High Sierra allows admins to unlock the AppStore Preferences in System Preferences by providing any password.  [Read More]
https://www.securityweek.com/apple-working-patch-new-years-eve-macos-flaw,Apple Working on Patch for New Year's Eve macOS Flaw,Apple says it will patch the macOS vulnerability disclosed by a researcher on New Year’s Eve later this month  [Read More]
https://www.securityweek.com/unpatched-macos-flaw-allows-code-execution-root-access,"Unpatched macOS Flaw Allows Code Execution, Root Access",Hacker releases details and PoC exploit for unpatched macOS vulnerability that can be exploited to execute arbitrary code and obtain root access to a system  [Read More]
https://www.securityweek.com/apple-patches-vulnerabilities-macos-watchos-and-tvos,"Apple Patches Vulnerabilities in macOS, watchOS, and tvOS","Apple this week released security updates for macOS, watchOS, and tvOS, as well as updated versions of the Safari browser and the iTunes for Windows application.  [Read More]"
https://www.securityweek.com/apple-patches-usb-code-execution-flaw-macos,Apple Patches USB Code Execution Flaw in macOS,"One of the vulnerabilities addressed by Apple in its latest set of security patches for macOS is an arbitrary code execution flaw, which could be exploited via malicious USB devices.  [Read More]"
