Link,Title,Intro
https://www.securityweek.com/mac-firmware-updates-are-failing-and-leaving-systems-vulnerable-report,Mac Firmware Updates Are Failing and Leaving Systems Vulnerable: Report,"There is a discrepancy between the frequency and thoroughness of Apple's Mac Operating System (OS X) and app security updates, and updates for the underlying firmware (EFI) on Mac computers.  [Read More]"
https://www.securityweek.com/apple-patches-vulnerabilities-macos-macos-server,"Apple Patches Vulnerabilities in macOS, macOS Server","Apple released security patches for its macOS users, available as part of the macOS High Sierra 10.13 platform upgrade.  [Read More]"
https://www.securityweek.com/secure-kernel-extension-loading-macos-easily-bypassed-researcher,Secure Kernel Extension Loading in macOS Easily Bypassed: Researcher,"Apple's new Secure Kernel Extension Loading (SKEL) security feature, set to be implemented in the upcoming macOS 10.13 High Sierra, is trivial to bypass, a security researcher claims.  [Read More]"
https://www.securityweek.com/researchers-poison-machine-learning-engines,Researchers Poison Machine Learning Engines,Researchers have demonstrated that convolutional neural networks (CNNs) can be backdoored to produce false but controlled outputs.  [Read More]
https://www.securityweek.com/critical-vulnerability-found-diebold-atm-machine,Critical Vulnerability Found in Diebold ATM Machine,Seattle-based IOActive has issued a critical security advisory detailing a physical and authentication bypass in the Diebold Opteva ATM.  [Read More]
https://www.securityweek.com/windows-macos-hacked-pwn2own-2017,"Windows, macOS Hacked at Pwn2Own 2017","Windows, macOS, Edge, Safari, Flash Player and Firefox were hacked on the second day of the Pwn2Own 2017 competition  [Read More]"
https://www.securityweek.com/apple-patches-72-vulnerabilities-macos-sierra,Apple Patches 72 Vulnerabilities in macOS Sierra,Apple has patched more than 70 vulnerabilities with the release of macOS Sierra 10.12.2  [Read More]
https://www.securityweek.com/vmware-flaws-allow-security-bypass-mac-os-x,VMware Flaws Allow Security Bypass on Mac OS X,VMware Tools and Fusion products for Mac OS X are affected by information disclosure vulnerabilities  [Read More]
https://www.securityweek.com/apple-patches-multiple-flaws-ios-macos-sierra-safari,"Apple Patches Multiple Flaws in iOS, macOS Sierra, Safari","Apple this week released a new set of security patches to resolve multiple vulnerabilities in iOS, macOS Sierra, Safari, tvOS, and watchOS.  [Read More]"
https://www.securityweek.com/macos-1012-patches-over-60-vulnerabilities,macOS 10.12 Patches Over 60 Vulnerabilities,Apple on Tuesday released the final version of macOS Sierra 10.12 as a free update and announced that no less than 65 security vulnerabilities were addressed in this operating system version.  [Read More]
https://www.securityweek.com/little-snitch-flaw-exposed-mac-systems-attacks,Little Snitch Flaw Exposed Mac Systems to Attacks,A privilege escalation vulnerability in the Mac OS X firewall Little Snitch can be exploited to execute arbitrary code in the kernel  [Read More]
https://www.securityweek.com/apple-reissues-security-update-after-blocking-ethernet-mac-os-x,Apple Reissues Security Update After Blocking Ethernet on Mac OS X,Apple over the weekend reissued a security update for OS X El Capitan systems after the initial update blocked Apple’s own Ethernet drivers.  [Read More]
https://www.securityweek.com/mac-os-x-ios-registered-most-disclosed-vulnerabilities-2015,"Mac OS X, iOS Registered Most Disclosed Vulnerabilities in 2015","Apple’s desktop and mobile operating systems are at the top of the list when it comes to the number of distinct vulnerabilities that have been publicly disclosed in 2015, data from vulnerability aggregator CVE Details shows.  [Read More]"
https://www.securityweek.com/apple-patches-recently-disclosed-mac-efi-security-bugs,Apple Patches Recently Disclosed Mac EFI Security Bugs,"Apple has patched a large number of vulnerabilities in its products, including the recently disclosed Mac EFI bugs.  [Read More]"
https://www.securityweek.com/efi-zero-day-exposes-macs-rootkit-attacks-researcher,EFI Zero-Day Exposes Macs to Rootkit Attacks: Researcher,A researcher has discovered an EFI firmware zero-day that allows malicious actors to remotely install rootkits on Macs.  [Read More]
https://www.securityweek.com/mackeeper-patches-serious-remote-code-execution-flaw,MacKeeper Patches Serious Remote Code Execution Flaw,MacKeeper developers fix URL handler vulnerability that can be exploited to execute arbitrary code. A researcher has published a PoC for the security bug.  [Read More]
https://www.securityweek.com/researcher-reveal-mac-os-x-dll-hijacking-attack,Researcher to Reveal Mac OS X DLL Hijacking Attack,"At the CanSecWest conference, a researcher will demonstrate an attack targeting OS X that is similar to DLL hijacking attacks on Windows.  [Read More]"
https://www.securityweek.com/box-sync-mac-exposed-sensitive-information-researcher,Box Sync for Mac Exposed Sensitive Information: Researcher,"The Mac version of Box Sync exposed sensitive information such as internal user IDs, passwords, and API keys, a researcher discovered.  [Read More]"
https://www.securityweek.com/mac-os-x-affected-critical-rootpipe-privilege-escalation-vulnerability,"Mac OS X Affected by Critical ""Rootpipe"" Privilege Escalation Vulnerability","The latest version of Apple's Mac operating system, OS X 10.10 Yosemite, is plagued by a critical vulnerability that can be exploited to take over affected devices, a researcher has revealed.  [Read More]"
https://www.securityweek.com/apple-software-update-protects-macs-bash-bug,Apple Software Update Protects Macs from 'Bash' Bug,"Apple on issued a software update to protect Mac OS X computers from the recently discovered ""Bash"" bug also known as Shellshock.  [Read More]"
https://www.securityweek.com/apple-says-mac-users-mostly-safe-bash-bug,Apple Says Mac Users Mostly Safe from 'Bash' Bug,"Apple said Friday that its Macintosh PCs are unlikely to be affected by the recently discovered ""Bash"" bug that could hit millions of computers and other devices connected to the Internet.  [Read More]"
https://www.securityweek.com/apple-fixes-numerous-vulnerabilities-release-mac-os-x-1095,Apple Fixes Numerous Vulnerabilities With Release of Mac OS X 10.9.5,"Apple has addressed more than 40 vulnerabilities affecting components such as PHP, Bluetooth, the CoreGraphics framework, the Intel graphics driver, the Foundation framework, IOKit, IOHIDFamily, IOAcceleratorFamily, the kernel, OpenSSL, QT Media Foundation and Ruby.  [Read More]"
https://www.securityweek.com/adobe-brings-flash-player-sandbox-safari-mac-os-x,Adobe Brings Flash Player Sandbox to Safari on Mac OS X,"Adobe said that its popular Flash Player is now protected by an OS X App Sandbox as part of this week’s release of Safari in OS X Mavericks, giving Safari users on Apple's latest OS the ability to view Flash Player content while benefiting from added security protections.  [Read More]"
https://www.securityweek.com/qualys-adds-automated-scanning-expanded-mac-support-browsercheck,"Qualys Adds Automated Scanning, Expanded Mac Support to BrowserCheck","The latest version of Qualys BrowserCheck, now includes expanded support for Mac OS browsers and enables users to automatically run daily scans.  [Read More]"
https://www.securityweek.com/uyghur-activists-once-again-targeted-mac-os-malware,Uyghur Activists Once Again Targeted by Mac OS Malware,A malicious campaign that started last summer is once again targeting Uyghur activist groups in China.  [Read More]
https://www.securityweek.com/voting-machines-remain-worry-us-election,Voting Machines Remain Worry in US Election,The 2012 US Presidential election result could be clouded by problems with voting machines that have security flaws or may not allow for recounts or audits.  [Read More]
https://www.securityweek.com/oracle-boosts-mac-os-x-support-latest-java-release,Oracle Boosts Mac OS X Support In Latest Java Release,"Oracle this week released the latest version of Java, including full support for Mac OS X. In addition to Java SE 7 Update 6, Oracle also released JavaFX 2.2 and JavaFX Scene Builder.  [Read More]"
https://www.securityweek.com/apple-mac-os-x-leopard-updates-target-flashback-trojan-old-flash-player-versions,"Apple Mac OS X Leopard Updates Target Flashback Trojan, Old Flash Player Versions",Apple released security updates Monday targeting Mac OS X 10.5 users in order to nuke both outdated versions of Adobe System's Flash Player as well as the infamous Flashback Trojan.  [Read More]
https://www.securityweek.com/debug-setting-mac-os-x-lion-exposing-legacy-passwords,Debug Setting in Mac OS X Lion Exposing Legacy Passwords,"On Friday, security researcher David Emery reported the discovery of a problem within OS X 10.7.3, which results in a user’s password being recorded to a log file in plain text.  [Read More]"
https://www.securityweek.com/apple-update-fixes-remote-code-execution-flaws-mac-os-x,Apple Update Fixes Remote Code Execution Flaws in Mac OS X,"Apple addressed over thirty serious vulnerabilities in the Safari Web browser and Mac OS X Mountain Lion, Lion, and Snow Leopard.  [Read More]"
https://www.securityweek.com/google-expands-safe-browsing-protection-macos,Google Expands Safe Browsing Protection on macOS,Google expands Safe Browsing on macOS to protect Chrome users against ad injections and unauthorized settings changes  [Read More]
https://www.securityweek.com/mac-malware-can-abuse-legitimate-apps-spy-users,Mac Malware Can Abuse Legitimate Apps to Spy on Users,OS X malware can silently record audio and video from infected Macs by piggybacking on sessions initiated by legitimate applications such as FaceTime and Skype  [Read More]
https://www.securityweek.com/attackers-hide-malicious-macros-mhtml-documents,Attackers Hide Malicious Macros in MHTML Documents,Malicious macros hidden inside MHTML documents used to distribute the Dyre banking Trojan.  [Read More]
https://www.securityweek.com/dridex-banking-malware-dodges-detection-run-close-macros,Dridex Banking Malware Dodges Detection With Run-on-Close Macros,"The Dridex malware can now wait until the malicious document is closed before executing, according to Proofpoint.  [Read More]"
https://www.securityweek.com/attackers-spread-dridex-banking-trojan-malicious-macros,Attackers Spread Dridex Banking Trojan Via Malicious Macros,"Attackers are using documents laced with malicious macros to spread the Dridex Trojan, according to Trustwave.  [Read More]"
https://www.securityweek.com/attacks-using-macro-enabled-threats-jumped-december-microsoft,Attacks Using Macro-Enabled Threats Jumped in December: Microsoft,Researchers at Microsoft are reporting a spike in the use of macros to spread malware via spam and social engineering.  [Read More]
https://www.securityweek.com/new-pos-malware-hits-e-kiosks-and-ticket-vending-machines,New PoS Malware Hits E-kiosks and Ticket Vending Machines,Researchers at IntelCrawler say a new piece of point-of-sale malware is hitting mass transit systems and mixes backdoor functionality with RAM scrapping and keylogging features.  [Read More]
https://www.securityweek.com/mac-security-products-put-test,Mac Security Products Put to the Test,Two well known independent antivirus testing labs have published the results of tests performed on security products designed for devices running Mac OS X operating systems.  [Read More]
https://www.securityweek.com/mac-malware-targets-bitcoin-wallet-logins,Mac Malware Targets Bitcoin Wallet Logins,"A new Trojan has been spotted targeting login information for bitcoin sites, according to Secure Mac.  [Read More]"
https://www.securityweek.com/mac-malware-variant-updated-new-tricks,Mac Malware Variant Updated With New Tricks,"A new variant of malware known as 'Crisis' is targeting Mac computers, according to Intego.  [Read More]"
https://www.securityweek.com/mac-malware-uses-right-left-override-technique-disguise-executables,Mac Malware Uses Right-to-Left Override Technique to Disguise Executables,Researchers at F-Secure shine a light on a piece of Mac malware using a technique commonly scene among Windows malware.  [Read More]
https://www.securityweek.com/mayan-apocalypse-fears-exploited-macro-virus,Mayan Apocalypse Fears Exploited by Macro Virus,Malicious PowerPoint file infects users via macros using talk of an impending apocalypse as a lure.  [Read More]
https://www.securityweek.com/mac-malware-targeting-dalai-lama-supporters,Mac Malware Targeting Dalai Lama Supporters,"According to security researchers, the malware appears to be another recent example of attacks targeting Tibetan activists.  [Read More]"
https://www.securityweek.com/apple-include-auto-updates-mac-os-x-mountain-lion,Apple to Include Auto-Updates in Mac OS X Mountain Lion,"The latest version of Apple’s Mac OS X, Mountain Lion, due in just a few short weeks, will come with a rather important security feature – automatic updating.  [Read More]"
https://www.securityweek.com/new-variant-mac-flashback-trojan-appears,New Variant of Mac Flashback Trojan Appears,A new variant of the Flashback Trojan has been found targeting Mac computers  [Read More]
https://www.securityweek.com/flashback-trojan-puts-mac-malware-back-stage,Flashback Trojan Puts Mac Malware Back on Stage,"The week opened with a report that Apple had updated its blacklist of known malware to include the Trojan dropper Revir, and it is closing with reports about the spread of a new Trojan known as Flashback.  [Read More]"
https://www.securityweek.com/its-time-machine-learning-prove-its-own-hype,It's Time For Machine Learning to Prove Its Own Hype,Machine learning is a black box that is poorly understood; and security practitioners like to know exactly what it is they are buying and using.  [Read More]
https://www.securityweek.com/new-dok-mac-osx-malware-steals-sensitive-data,"New ""Dok"" Mac OSX Malware Steals Sensitive Data","New malware able to spy on OSX users' internet traffic, including https traffic, has been found targeting European users.  [Read More]"
https://www.securityweek.com/fireeye-becomes-av-replacement-adds-macos-support,"FireEye Becomes AV Replacement, Adds macOS Support","FireEye today unveiled major updates to its endpoint security platform, including two new protection engines and support for Apple’s macOS systems.  [Read More]"
https://www.securityweek.com/office-2013-gets-macro-blocking-feature,Office 2013 Gets Macro-Blocking Feature,Microsoft announced boosted customer security with a new feature in Office 2013: the ability to block risky macros right from the start.  [Read More]
https://www.securityweek.com/symantec-adds-machine-learning-endpoint-security-lineup,Symantec Adds Machine Learning to Endpoint Security Lineup,"Symantec Endpoint Protection Cloud (SEPC) combines three new technologies (advanced machine learning, an intelligent threat cloud, and generic exploit mitigation) with the traditional technologies.  [Read More]"
https://www.securityweek.com/machine-learning-crowdstrike-joins-virustotal,Machine Learning CrowdStrike Joins VirusTotal,The move by CrowdStrike to join VirusTotal is a positive sign that at least one next-gen vendor is willing to integrate into the overall anti-malware market for the benefit of all users.  [Read More]
https://www.securityweek.com/new-tool-aims-generically-detect-os-x-ransomware,New Tool Aims to Generically Detect Mac OS X Ransomware,Researcher releases new tool designed to generically detect ransomware attacks on OS X systems  [Read More]
https://www.securityweek.com/microsoft-blocks-risky-macros-office-2016,Microsoft Blocks Risky Macros in Office 2016,"In an effort to counter the use of malicious macros to deliver malware, Microsoft has packed a new macro blocking feature into Office 2016.  [Read More]"
https://www.securityweek.com/intego-eset-update-mac-os-x-security-suites,"Intego, ESET Update Mac OS X Security Suites","Mac security software maker Intego released is 2013 line of antivirus and security products for the Mac OS X, along with ESET who launched its latest Mac specific security suite earlier this month.  [Read More]"
https://www.securityweek.com/perimeter-e-security-launches-web-security-solution-mac-os,Perimeter E-Security Launches Web Security Solution for Mac OS,"Perimeter E-Security, a provider of cloud and messaging security services, today launched a Mac OS X version of their SaaS Web Security solution.  [Read More]"
https://www.securityweek.com/kaspersky-lab-launches-new-security-software-suite-mac-os-x,Kaspersky Lab Launches New Security Software Suite for Mac OS X,"Kaspersky Lab on Monday announced Kaspersky Security for Mac, the Company’s new security suite designed to protect Mac OS X based systems.  [Read More]"
https://www.securityweek.com/mac-os-x-lion-login-passwords-extracted-ease,Mac OS X Lion Login Passwords Extracted With Ease,"Passware Inc., a provider of password recovery, decryption, and electronic evidence discovery software, today said that the latest edition of its flagship password cracking forensic suite, Passware Kit Forensic v1, can Mac OS X Lion user login passwords from system memory in a matter of minutes.  [Read More]"
https://www.securityweek.com/mac-os-x-lion-brings-added-security-and-privacy-features,Mac OS X Lion Brings Added Security and Privacy Features,"While OS X Lion flaunts more than 250 new features, we thought it would be appropriate to run through them and highlight some of the security and privacy related features that would be of interest to our security-minded audience.  [Read More]"
https://www.securityweek.com/panda-security-launches-antivirus-corporate-edition-mac,Panda Security Launches Antivirus Corporate Edition for Mac,"New Mac Antivirus solution helps protects against threats for Mac OS X and Windows in Mac desktops, laptops and servers; also protects iPhone, iPad and iPod devices.  [Read More]"
https://www.securityweek.com/coretrace-brings-application-whitelisting-mac-and-linux,CoreTrace Brings Application Whitelisting to Mac and Linux,BOUNCER by CoreTrace Brings Cross-Platform Application Whitelisting Coverage to Mac and Linux  [Read More]
https://www.securityweek.com/panda-security-launches-antivirus-software-mac,Panda Security Launches Antivirus Software for Mac,"This new anti virus solution for Mac helps protect users from malware affecting Mac OS and Mac OS X and scans files and email, detecting and eliminating or blocking many types of threats, including viruses, Trojans, spyware, keyloggers, adware, hacking tools, botnets, dialers, scareware and other threats.  [Read More]"
