Link,Title,Intro
https://www.securityweek.com/microsoft-adds-multi-factor-authentication-windows-azure,Microsoft Adds Multi-Factor Authentication for Windows Azure,Microsoft rolled out the options for customers to enable multi-factor authentication its Windows Azure cloud service.  [Read More]
https://www.securityweek.com/barracuda-partners-microsoft-protect-windows-azure-applications,Barracuda Partners With Microsoft to Protect Windows Azure Applications,Barracuda Networks has teamed up with Microsoft to bring additional levels of protection to web applications and data hosted in Microsoft’s Windows Azure cloud.  [Read More]
https://www.securityweek.com/windows-hello-face-recognition-tricked-photo,Windows Hello Face Recognition Tricked by Photo,Face authentication system present in Windows Hello tricked by researchers using a printed photo  [Read More]
https://www.securityweek.com/app-paths-used-bypass-user-account-control-windows-10,App Paths Used to Bypass User Account Control in Windows 10,A newly technique that leverages App Paths to bypass the User Account Control (UAC) in Windows 10 has been detailed by security researcher Matt Nelson.  [Read More]
https://www.securityweek.com/windows-bug-leaks-microsoft-account-login-data,Windows Bug Leaks Microsoft Account Login Data,"An issue affecting Microsoft’s Windows operating system could result in leaked user credentials if Internet Explorer and Edge are being used, researchers discovered.  [Read More]"
https://www.securityweek.com/credential-hijacking-vulnerability-impacts-all-versions-windows-cylance,Credential Hijacking Vulnerability Impacts All Versions of Windows: Cylance,"The ""Re-Direct to SMB"" vulnerability impacts all versions of Windows, including the upcoming Windows 10, as well as products from major software makers such as Adobe, Apple, Oracle, and Symantec.  [Read More]"
https://www.securityweek.com/windows-10-devices-allow-sign-face-iris,"Windows 10 Devices to Allow Sign in With Face, Iris","The new Windows 10 operating system will allow users to sign in to a device without a password by using biometrics, including facial recognition.  [Read More]"
https://www.securityweek.com/windows-authentication-protocol-allows-deactivated-user-accounts-live-report,Windows Authentication Protocol Allows Deactivated User Accounts to Live On: Report,"The Kerberos authentication protocol enables a disabled user account to remain valid for up to 10 hours after having been revoked, researchers say.  [Read More]"
https://www.securityweek.com/windows-information-protection-address-data-leaks-windows-10,Windows Information Protection to Address Data Leaks in Windows 10,"Windows 10 Anniversary update includes Windows Information Protection (WIP), a feature meant to keep user’s information safe even when data leaks occur.  [Read More]"
https://www.securityweek.com/microsoft-stores-windows-10-encryption-keys-cloud,Microsoft Stores Windows 10 Encryption Keys in the Cloud,"Windows 10 devices have built-in disk encryption that is turned on out of the box, offering additional data protection, but the recovery keys are automatically copied to Microsoft servers when users login using their Microsoft accounts.  [Read More]"
https://www.securityweek.com/microsoft-windows-sleep-feature-poses-security-risk,Microsoft Windows Sleep Feature Poses Security Risk,"A sleep feature in Microsoft Windows may significantly reduce security of full disk encryption, Passware warned today.  [Read More]"
https://www.securityweek.com/microsoft-experts-launch-anti-recon-tool-windows-10-server-2016,"Microsoft Experts Launch Anti-Recon Tool for Windows 10, Server 2016","Microsoft researchers release SAMRi10, a new anti-reconnaissance tool for Windows 10 and Windows Server 2016  [Read More]"
https://www.securityweek.com/attackers-fire-windows-xp-users-recently-discovered-ie-zero-day,Attackers Fire at Windows XP Users With Recently Discovered IE Zero-Day,"Attackers are exploiting a recently disclosed zero-day vulnerability in Internet Explorer in campaigns targeting Windows XP users. While the vulnerability was patched by Microsoft in an Out-of-Band release on Thursday, security researchers have discovered a series of attacks targeting various industries.  [Read More]"
https://www.securityweek.com/fileless-attack-can-bypass-user-account-control-windows-10,Fileless Attack Can Bypass User Account Control in Windows 10,"A recently disclosed User Account Control (UAC) bypass that leverages App Paths can be used for fileless attacks as well, security researcher Matt Nelson now says.  [Read More]"
https://www.securityweek.com/windows-uac-bypassed-using-event-viewer,Windows UAC Bypassed Using Event Viewer,Researchers once again bypass the User Account Control (UAC) security feature in Windows – this time they used the Event Viewer  [Read More]
https://www.securityweek.com/windows-updates-deliver-intels-spectre-microcode-patches,Windows Updates Deliver Intel's Spectre Microcode Patches,Microsoft has started distributing some of Intel’s microcode patches for the Spectre vulnerability to Windows users  [Read More]
https://www.securityweek.com/windows-analytics-helps-assess-risk-meltdown-spectre-attacks,"Windows Analytics Helps Assess Risk of Meltdown, Spectre Attacks",Microsoft has added new capabilities to its Windows Analytics service to help IT professionals assess whether the Windows devices in their networks are protected against Spectre and Meltdown attacks.  [Read More]
https://www.securityweek.com/microsoft-patches-50-flaws-windows-office-browsers,"Microsoft Patches 50 Flaws in Windows, Office, Browsers","Microsoft patches 50 vulnerabilities in Windows, Office and its web browsers – the list does not include any zero-day flaws  [Read More]"
https://www.securityweek.com/windows-10-ransomware-protection-easily-bypassed-researcher-says,"Windows 10 Ransomware Protection Easily Bypassed, Researcher Says","It’s rather trivial to bypass the anti-ransomware feature that Microsoft introduced in its Windows 10 Fall Creators Update, a security researcher claims.  [Read More]"
https://www.securityweek.com/windows-8-and-later-fail-properly-apply-aslr,Windows 8 and Later Fail to Properly Apply ASLR,Address Space Layout Randomization (ASLR) isn’t properly applied on versions of Microsoft Windows 8 and newer.  [Read More]
https://www.securityweek.com/varied-patch-process-microsoft-exposes-windows-users-google-researcher,Varied Patch Process by Microsoft Exposes Windows Users: Google Researcher,"Not all Windows releases receive the same treatment when it comes to security patches, leaving some users exposed to known vulnerabilities.  [Read More]"
https://www.securityweek.com/firefox-support-windows-xp-and-vista-ends-june-2018,Firefox Support for Windows XP and Vista Ends June 2018,Mozilla announced that support for Microsoft's Windows XP and Vista operating systems will be completely removed in June 2018.  [Read More]
https://www.securityweek.com/illusion-gap-attack-bypasses-windows-defender,"""Illusion Gap"" Attack Bypasses Windows Defender","Windows Defender detection can be bypassed by tricking the antivirus application into scanning a different file or nothing at all, CyberArk Labs reveals.  [Read More]"
https://www.securityweek.com/windows-kernel-bug-hinders-malware-detection-researchers,Windows Kernel Bug Hinders Malware Detection: Researchers,"A kernel bug that impacts Windows versions released over the past decade and a half remains unpatched, enSilo security researchers claim.  [Read More]"
https://www.securityweek.com/eternalsynergy-based-exploit-targets-recent-windows-versions,EternalSynergy-Based Exploit Targets Recent Windows Versions,A security researcher has devised an EternalSynergy-based exploit that can compromise versions of Windows newer than Windows 8.  [Read More]
https://www.securityweek.com/microsoft-make-emet-native-windows-10,Microsoft to Make EMET Native to Windows 10,"Microsoft is no longer interested in retiring Enhanced Mitigation Experience Toolkit (EMET) but will instead make it native to Windows 10, the tech giant announced.  [Read More]"
https://www.securityweek.com/uks-metropolitan-police-still-using-10000-windows-xp-computers,"UK's Metropolitan Police Still Using 10,000 Windows XP Computers","Legacy WindowsXP systems used by public authorities in the UK remains a concern, as the UK's Metropolitan Police is still using approximately 10,000 XP Computers  [Read More]"
https://www.securityweek.com/windows-10-source-code-leaked-online,Windows 10 Source Code Leaked Online,A portion of Microsoft’s Windows 10 source code was leaked online this week on an enthusiast website that tracks Windows releases.  [Read More]
https://www.securityweek.com/ghosthook-attack-can-bypass-windows-10s-patchguard,GhostHook Attack Can Bypass Windows 10's PatchGuard,"A newly discovered attack targeting Windows 10’s PatchGuard can bypass the protection and hook a malicious kernel code (rootkit) at the kernel level, CyberArk Labs security researchers warn.  [Read More]"
https://www.securityweek.com/critical-flaw-patched-bind-installer-windows,Critical Flaw Patched in BIND Installer for Windows,"Updates released for DNS software BIND address a critical vulnerability in the installer delivered with BIND for Windows, and which could have been exploited for privilege escalation, the Internet Systems Consortium (ISC) announced.  [Read More]"
https://www.securityweek.com/microsoft-patches-windows-flaws-exploited-attacks,Microsoft Patches Windows Flaws Exploited in Attacks,"Microsoft released patches for more than 90 vulnerabilities on June 13, including two critical remote code execution flaws that have been exploited in attacks.  [Read More]"
https://www.securityweek.com/google-chrome-bug-leads-windows-credential-theft,Google Chrome Bug Leads to Windows Credential Theft,"An issue with the manner in which Google Chrome and Windows handle specific file types can lead to credential theft even on up-to-date systems, a DefenseCode researcher has discovered.  [Read More]"
https://www.securityweek.com/windows-zero-day-exploited-adgholas-neutrino-ek,"Windows Zero-Day Exploited by AdGholas, Neutrino EK",Windows zero-day patched this month by Microsoft exploited since last summer by Neutrino EK and AdGholas malvertising campaign  [Read More]
https://www.securityweek.com/windows-macos-hacked-pwn2own-2017,"Windows, macOS Hacked at Pwn2Own 2017","Windows, macOS, Edge, Safari, Flash Player and Firefox were hacked on the second day of the Pwn2Own 2017 competition  [Read More]"
https://www.securityweek.com/temporary-fix-available-windows-gdi-vulnerability,Temporary Fix Available for Windows GDI Vulnerability,A temporary fix is available for the Windows Graphics Device Interface (Windows GDI) vulnerability (CVE-2017-0038) that was disclosed a couple of weeks ago.  [Read More]
https://www.securityweek.com/google-discloses-unpatched-windows-gdi-vulnerability,Google Discloses Unpatched Windows GDI Vulnerability,An unpatched vulnerability affecting the Windows Graphics Device Interface (Windows GDI) was publicly disclosed last week after Microsoft failed to address it within 90 days after being notified.  [Read More]
https://www.securityweek.com/windows-smb-0-day-risk-downplayed,Windows SMB 0-Day Risk Downplayed,"A 0-day vulnerability affecting Windows’ SMBv3 (Server Message Block) protocol that was revealed last week is no longer considered a Critical issue, but High-risk.  [Read More]"
https://www.securityweek.com/windows-smb-0-day-exposes-systems-attacks,Windows SMB 0-Day Exposes Systems to Attacks,A 0-day memory corruption vulnerability discovered in the SMB (Server Message Block) protocol can be exploited to cause denial of service or potentially execute arbitrary code on a vulnerable system.  [Read More]
https://www.securityweek.com/gmail-drops-support-chrome-windows-xp-and-vista,Gmail Drops Support for Chrome on Windows XP and Vista,"Gmail will soon drop support for Chrome version 53 and below, a move expected to hit Windows XP and Vista users the most.  [Read More]"
https://www.securityweek.com/windows-10-blocks-zero-days-patches-arrive-microsoft,Windows 10 Blocks Zero-Days Before Patches Arrive: Microsoft,"Microsoft's Windows 10 can block exploitation of zero-day vulnerabilities before they are even patched, Microsoft says.  [Read More]"
https://www.securityweek.com/shadow-brokers-now-selling-windows-av-exploits-new-zeronet-marketplace,"Shadow Brokers Now Selling Windows, AV Exploits in New ZeroNet Marketplace",The group calling itself “Shadow Brokers” is offering Windows exploits and anti-virus bypass tools for sale in a new underground marketplace.  [Read More]
https://www.securityweek.com/poc-exploit-leads-discovery-two-windows-flaws,PoC Exploit Leads to Discovery of Two Windows Flaws,Proof-of-concept (PoC) code for one DoS vulnerability in Windows leads to the discovery of a different but similar flaw  [Read More]
https://www.securityweek.com/microsoft-patches-flaws-windows-office-edge,"Microsoft Patches Flaws in Windows, Office, Edge","Microsoft has patched vulnerabilities in Windows, Office and Edge, but only released four security bulletins  [Read More]"
https://www.securityweek.com/mozilla-kill-firefox-windows-xp-vista-2017,"Mozilla to Kill Firefox for Windows XP, Vista in 2017","Support for Windows XP and Vista will be removed from Firefox, currently the last major web browser out there to still support the two outdated operating system versions.  [Read More]"
https://www.securityweek.com/shiftf10-during-windows-10-updates-can-bypass-bitlocker,SHIFT+F10 During Windows 10 Updates Can Bypass BitLocker,"During the more frequent feature updates in Windows 10, pressing SHIFT+F10 gives the user admin privileges while BitLocker is disabled.  [Read More]"
https://www.securityweek.com/microsofts-emet-protects-apps-better-windows-10-researcher-says,"Microsoft's EMET Protects Apps Better Than Windows 10, Researcher Says","While packed with a load of new security features, Window 10 doesn’t offer some of the additional protections that Microsoft’s Enhanced Mitigation Experience Toolkit (EMET) brings, CERT vulnerability analyst Will Dormann warns.  [Read More]"
https://www.securityweek.com/microsoft-patches-windows-zero-day-exploited-russian-hackers,Microsoft Patches Windows Zero-Day Exploited by Russian Hackers,"Microsoft patches two Windows zero-day vulnerabilities, including the one exploited by the Russia-linked cyber espionage group Pawn Storm/APT28  [Read More]"
https://www.securityweek.com/ongoing-use-windows-vista-ie8-threaten-enterprises,"Ongoing Use of Windows Vista, IE8 Pose Huge Enterprise Threat",A new report highlights the high number of users still operating outdated Windows operating systems and unsupported browsers.  [Read More]
https://www.securityweek.com/google-discloses-windows-zero-day-vulnerability,Google Discloses Windows Zero-Day Vulnerability,Google discloses Windows zero-day vulnerability exploited in the wild after giving Microsoft 7 days to come up with a patch  [Read More]
https://www.securityweek.com/atombombing-windows-vulnerability-cannot-be-patched,AtomBombing: The Windows Vulnerability that Cannot be Patched,"Researchers have discovered a code-injection vulnerability in the Windows operating system that cannot, because of the nature of the operating system, be patched.  [Read More]"
https://www.securityweek.com/apple-patches-flaws-xcode-windows-software,"Apple Patches Flaws in Xcode, Windows Software",Apple patches a dozen vulnerabilities in Xcode and the Windows versions of iCloud and iTunes  [Read More]
https://www.securityweek.com/microsoft-removes-windows-journal-due-security-flaws,Microsoft Removes Windows Journal Due to Security Flaws,Microsoft removes the Windows Journal component from its operating systems following the discovery of many vulnerabilities  [Read More]
https://www.securityweek.com/windows-7-81-adopt-monthly-rollup-patch-model,"Windows 7, 8.1 to Adopt ""Monthly Rollup"" Patch Model","Windows 7 and Windows 8.1 users who miss their security updates for a few months or longer will only have to install a single ""Monthly Rollup"" package to get both the missed and the current software patches.  [Read More]"
https://www.securityweek.com/microsoft-patches-flaws-windows-office-browsers,"Microsoft Patches Flaws in Windows, Office, Browsers","Microsoft patches 27 vulnerabilities in Windows, Office, Edge and Internet Explorer  [Read More]"
https://www.securityweek.com/russian-hackers-favor-windows-office-exploits-report,"Russian Hackers Favor Windows, Office Exploits: Report","Adobe’s Flash Player might be the most targeted product when criminal exploit kits are involved, Microsoft Office, Windows and Internet Explorer take center stage when Russian advanced persistent threat (APT) groups are involved.  [Read More]"
https://www.securityweek.com/bounty-hunters-invited-hack-edge-windows-preview-builds,Bounty Hunters Invited to Hack Edge on Windows Preview Builds,"Microsoft offers up to $15,000 to researchers who find remote code execution flaws in Edge running on Windows Insider Preview builds  [Read More]"
https://www.securityweek.com/new-windows-attack-turns-evil-maid-malicious-butler,New Windows Attack Turns Evil Maid into Malicious Butler,Microsoft researchers demonstrate how a known evil maid attack against Windows can be launched remotely  [Read More]
https://www.securityweek.com/new-windows-10-installations-require-signed-kernel-mode-drivers,New Windows 10 Installations Require Signed Kernel Mode Drivers,"Starting in Windows 10 version 1607, new kernel mode drivers will not be loaded unless they have been signed by Microsoft.  [Read More]"
https://www.securityweek.com/microsoft-patches-critical-flaws-windows-edge-office,"Microsoft Patches Critical Flaws in Windows, Edge, Office","Microsoft releases 16 security bulletins to address vulnerabilities in Windows, IE, Edge, Office and Exchange Server  [Read More]"
https://www.securityweek.com/windows-zero-day-exploit-sale-bids-start-95000,"Windows Zero-day Exploit for Sale: Bids Start at $95,000","A Windows 0-day described as a local privilege escalation (LPE) that works on all current versions of the Windows operating system, from XP to Windows 10 was put on sale at offers above $95,000.  [Read More]"
https://www.securityweek.com/windows-applocker-bypassed-execute-remote-scripts,Windows AppLocker Bypassed to Execute Remote Scripts,"Microsoft’s Windows AppLocker, a feature introduced in Windows 7 to specify which users can run apps within an organization, can be bypassed to execute remote scripts on a machine, a researcher has discovered.  [Read More]"
https://www.securityweek.com/microsoft-updates-windows-browsers-patch-critical-flaws,"Microsoft Updates Windows, Browsers to Patch Critical Flaws","Microsoft releases 13 security bulletins to patch tens of flaws in Windows, Internet Explorer, Edge, Office, Server Software and .NET  [Read More]"
https://www.securityweek.com/microsoft-patches-critical-flaws-windows-browsers,"Microsoft Patches Critical Flaws in Windows, Browsers","Microsoft’s February 2016 Patch Tuesday updates include 13 bulletins that fix serious vulnerabilities in Windows, Edge, Internet Explorer and Office  [Read More]"
https://www.securityweek.com/microsoft-emet-adds-windows-10-compatibility,Microsoft EMET Adds Windows 10 Compatibility,EMET 5.5 was released with improved configuration of various mitigations via Group Policy Object (GPO) and various EAF/EAF+ pseudo-mitigation performance improvements.  [Read More]
https://www.securityweek.com/microsoft-patches-windows-office-flaws-exploited-wild,"Microsoft Patches Windows, Office Flaws Exploited in the Wild","Microsoft releases security bulletins for December 2015 to patch tens of vulnerabilities, including two exploited in the wild  [Read More]"
https://www.securityweek.com/microsoft-fixes-critical-vulnerabilities-windows-ie-edge,"Microsoft Fixes Critical Vulnerabilities in Windows, IE, Edge","November 2015 security bulletins from Microsoft patch 49 vulnerabilities, more than 30 of which have been rated critical.  [Read More]"
https://www.securityweek.com/microsoft-patches-critical-flaws-windows-internet-explorer,"Microsoft Patches Critical Flaws in Windows, Internet Explorer","Microsoft releases updates to address more than 30 vulnerabilities affecting Internet Explorer, Edge, Windows, and Office.  [Read More]"
https://www.securityweek.com/microsoft-patches-windows-vulnerability-exploited-wild,Microsoft Patches Windows Vulnerability Exploited in the Wild,"Microsoft patches 5 publicly disclosed vulnerabilities, including one that has been exploited in the wild.  [Read More]"
https://www.securityweek.com/apple-patches-nine-vulnerabilities-quicktime-windows,Apple Patches Nine Vulnerabilities in QuickTime for Windows,Apple has patched nine vulnerabilities in QuickTime for Windows. The flaws can be exploited for DoS attacks and arbitrary code execution.  [Read More]
https://www.securityweek.com/microsoft-issues-emergency-fix-critical-flaw-affecting-all-versions-windows,Microsoft Issues Emergency Fix For Critical Flaw Affecting All Versions of Windows,Microsoft released an emergency out-of-band security update on Monday to address a critical vulnerability (CVE-2015-2426) in Windows that could allow a remote attacker to gain complete control of an affected system.  [Read More]
https://www.securityweek.com/microsoft-releases-critical-security-updates-internet-explorer-windows,"Microsoft Releases Critical Security Updates for Internet Explorer, Windows",Microsoft released eight security bulletins today for June's Patch Tuesday.  [Read More]
https://www.securityweek.com/widespread-windows-xp-use-remains-among-businesses-despite-end-life-survey,Widespread Windows XP Use Remains Among Businesses Despite End-of-Life: Survey,"Many businesses are still using Windows XP a year after Microsoft ended support, according to a new survey.  [Read More]"
https://www.securityweek.com/wi-fi-component-flaw-exposes-windows-linux-os-x-systems,"Wi-Fi Component Flaw Exposes Windows, Linux, OS X Systems","wpa_supplicant vulnerability exposes Windows, OS X and Linux systems to denial-of-service, memory contents exposure, and arbitrary code execution.  [Read More]"
https://www.securityweek.com/recently-patched-windows-flaw-exploited-wild-dos-attacks,Recently Patched Windows Flaw Exploited in the Wild for DoS Attacks,Critical vulnerability exploited by Microsoft earlier this week has been exploited in the wild to crash affected systems.  [Read More]
https://www.securityweek.com/microsoft-patches-critical-ie-windows-bugs-patch-tuesday-update,"Microsoft Patches Critical IE, Windows Bugs in Patch Tuesday Update",Microsoft issued patches today for critical vulnerabilities in Windows and Internet Explorer.  [Read More]
https://www.securityweek.com/microsoft-blacklists-fake-windows-live-ssl-certificate,Microsoft Blacklists Fake Windows Live SSL Certificate,Microsoft issued an advisory about a fake SSL certificate that can be used to spoof content.  [Read More]
https://www.securityweek.com/freak-vulnerability-affects-all-windows-versions-microsoft,FREAK Vulnerability Affects All Windows Versions: Microsoft,The SSL/TLS vulnerability dubbed FREAK affects Windows after all. Microsoft has promised to take action to address the issue.  [Read More]
https://www.securityweek.com/researchers-bypass-all-windows-protections-modifying-single-bit,Researchers Bypass All Windows Protections by Modifying a Single Bit,An exploit that modifies a single bit can be used to bypass all Windows security measures. The vulnerability was fixed by Microsoft with the latest Patch Tuesday update.  [Read More]
https://www.securityweek.com/microsoft-patches-critical-windows-internet-explorer-vulnerabilities-patch-tuesday-update,"Microsoft Patches Critical Windows, Internet Explorer Vulnerabilities in Patch Tuesday Update",Microsoft released nine security bulletins today to patch dozens of vulnerabilities in its products.  [Read More]
https://www.securityweek.com/google-discloses-windows-flaw-microsoft-failed-fix,Google Discloses Windows Flaw That Microsoft Failed to Fix,"Google has released the details of another Windows vulnerability. Microsoft planned on fixing the flaw with the January updates, but was forced to delay the patch due to compatibility issues.  [Read More]"
https://www.securityweek.com/microsoft-patches-critical-windows-security-vulnerability,Microsoft Patches Critical Windows Security Vulnerability,Microsoft released 8 security bulletins today for the first Patch Tuesday of the year.  [Read More]
https://www.securityweek.com/google-discloses-new-unpatched-windows-81-privilege-escalation-flaw,Google Discloses New Unpatched Windows 8.1 Privilege Escalation Flaw,Google published the details of a new privilege escalation vulnerability in Windows just as Microsoft was preparing to patch it.  [Read More]
https://www.securityweek.com/google-discloses-unpatched-windows-81-vulnerability,Google Discloses Unpatched Windows 8.1 Vulnerability,Google has published details and a proof-of-concept (PoC) for a local privilege escalation vulnerability affecting Windows 8.1  [Read More]
https://www.securityweek.com/windows-rce-vulnerability-exploited-wild,Windows RCE Vulnerability Exploited in the Wild,"Security companies have started detecting attacks that leverage a critical remote code execution (RCE) vulnerability in Windows, which Microsoft patched last week.  [Read More]"
https://www.securityweek.com/microsoft-preps-critical-ie-windows-patches,"Microsoft Preps Critical IE, Windows Patches","Microsoft is planning to release fixes for multiple products next week, including critical patches for Windows and Internet Explorer.  [Read More]"
