Link,Title,Intro
https://www.securityweek.com/microsoft-re-releases-windows-security-update-pulled-after-complaints,Microsoft Re-Releases Windows Security Update Pulled After Complaints,Microsoft re-released a patch in response to users' complaints that it was causing their systems to crash.  [Read More]
https://www.securityweek.com/microsoft-fixes-critical-vulnerabilities-internet-explorer-windows,"Microsoft Fixes Critical Vulnerabilities in Internet Explorer, Windows",Microsoft patched 37 vulnerabilities today as part of its Patch Tuesday release.  [Read More]
https://www.securityweek.com/security-updates-java-7-will-work-windows-xp-oracle,Security Updates for Java 7 Will Work on Windows XP: Oracle,"Oracle said future security patches for Java 7 will work on Windows XP, but pointed out that it can no longer provide ""complete guarantees"" for the software because the operating systems is no longer supported by Microsoft.  [Read More]"
https://www.securityweek.com/microsoft-releases-critical-patch-tuesday-updates-internet-explorer-windows,"Microsoft Releases Critical Patch Tuesday Updates for Internet Explorer, Windows","Microsoft addressed nearly 30 vulnerabilities in today's Patch Tuesday updates, including critical ones affecting Internet Explorer  [Read More]"
https://www.securityweek.com/microsoft-plans-critical-internet-explorer-windows-updates-patch-tuesday,"Microsoft Plans Critical Internet Explorer, Windows Updates for Patch Tuesday",The company plans to release six security bulletins as part of the monthly update.  [Read More]
https://www.securityweek.com/windows-registry-hack-updates-could-cause-functionality-issues-microsoft,Windows Registry Hack for Updates Could Cause Functionality Issues: Microsoft,Microsoft advised users not to apply a hack that tricks the Windows Update service into downloading updates for POSReady 2009 onto Windows XP machines.  [Read More]
https://www.securityweek.com/microsoft-patch-tuesday-fixes-critical-bugs-sun-sets-windows-xp,Microsoft Patch Tuesday Fixes Critical Bugs as Sun Sets on Windows XP,"All totaled, Microsoft issued four security bulletins this month covering issues in Office, IE and Windows.  [Read More]"
https://www.securityweek.com/xpocalypse-experts-warn-attackers-hoarding-windows-xp-forever-days,XPocalypse: Experts Warn of Attackers Hoarding Windows XP 'Forever Days',"Security experts believe criminals are hoarding XP vulnerabilities with plans to launch campaigns exploiting them at a later date, since those zero days will become ""forever days.""  [Read More]"
https://www.securityweek.com/microsoft-patches-critical-internet-explorer-windows-vulnerabilities,"Microsoft Patches Critical Internet Explorer, Windows Vulnerabilities",Microsoft adds critical Internet Explorer and Windows bulletins to the list of security patches issued today.  [Read More]
https://www.securityweek.com/microsoft-slates-critical-patch-tuesday-updates-windows-security-software,"Microsoft Slates Critical Patch Tuesday Updates for Windows, Security Software",Microsoft is prepping five security bulletins for release next week.  [Read More]
https://www.securityweek.com/microsoft-expands-100k-windows-bug-bounty-program,Microsoft Expands $100K Windows Bug Bounty Program,Microsoft will now accept submissions of exploits discovered in the wild.  [Read More]
https://www.securityweek.com/microsoft-re-releases-windows-server-security-update,Microsoft Re-releases Windows Server Security Update,Microsoft has re-released the update after an issue was discovered last week.  [Read More]
https://www.securityweek.com/microsoft-windows-xp-usage-means-zero-day-attacks-forever,Microsoft: Windows XP Usage Means Zero-Day Attacks Forever,Microsoft has a blunt warning for computer users still using Windows XP: Upgrade to a newer operating system now or risk exposure to zero-day attacks forever.  [Read More]
https://www.securityweek.com/microsoft-issues-9-security-bulletins-1-reminder-windows-xp-support-ends-2014,"Microsoft Issues 9 Security Bulletins, 1 Reminder: Windows XP Support Ends in 2014",Microsoft released critical fixes for Internet Explorer and Windows in this month's Patch Tuesday update.  [Read More]
https://www.securityweek.com/microsoft-releases-seven-security-bulletins-updates-windows-store-apps-follow,"Microsoft Releases Seven Security Bulletins, Updates for Windows Store Apps to Follow","Microsoft released seven bulletins addressing vulnerabilities in Internet Explorer, Microsoft Silverlight, Sharepoint, Visio, OneNote, and Office for Mac as part of its March Patch Tuesday.  [Read More]"
https://www.securityweek.com/microsoft-fixes-windows-security-flaws-patch-tuesday-update,Microsoft Fixes Windows Security Flaws in Patch Tuesday Update,Microsoft plugs 12 security holes in the first Patch Tuesday update of the year.  [Read More]
https://www.securityweek.com/vupen-researchers-say-they-defeated-windows-8-security,VUPEN Researchers Say They Defeated Windows 8 Security,VUPEN Security says it has chained multiple vulnerabilities in Windows 8 security and IE10 to bypass security protections and remotely execute code.  [Read More]
https://www.securityweek.com/microsoft-updating-ie10-flash-windows-8-good-move,"Microsoft Updating IE10 Flash in Windows 8 a ""Good Move""","Microsoft has reversed its earlier stance and promised a Flash update for Windows 8 users ""shortly.""  [Read More]"
https://www.securityweek.com/microsoft-advises-customers-disable-windows-sidebar-and-gadgets,Microsoft Advises Customers to Disable Windows Sidebar and Gadgets,"Microsoft has issued a security advisory, and encouraged users of Windows Vista and Windows 7 to disable the Windows Sidebar and associated gadgets.  [Read More]"
https://www.securityweek.com/secunia-helps-silently-patch-windows-software,Secunia Helps Silently Patch Windows Software,"Whether or not a software vendor provides automatic security updates no longer matters, as Secunia PSI 3.0 now lets users receive automatic security patch updates.  [Read More]"
https://www.securityweek.com/windows-xml-flaw-being-actively-exploited,Windows XML Flaw Being Actively Exploited,"On Tuesday, Microsoft patched over two dozen vulnerabilities across the Windows platform. At the same time, criminals started targeted a new vulnerability that has now become the topic of interest within the security-focused community, especially when Google announced that it is being actively exploited.  [Read More]"
https://www.securityweek.com/microsoft-hardens-windows-update-preps-25-security-fixes-patch-tuesday,"Microsoft Hardens Windows Update, Preps 25 Security Fixes for Patch Tuesday","Microsoft plans to issue fixes for 25 security vulnerabilities in its upcoming Patch Tuesday update for June 2012, and pledged to harden the Windows Update mechanism to prevent other attackers from taking the same action.  [Read More]"
https://www.securityweek.com/slow-patch-users-vulnerable-windows-media-player-exploit,Slow to Patch Users Vulnerable to Windows Media Player Exploit,"Attackers are going after a recently patched vulnerability in Windows Media Player (WMP), and users do not seem to be keeping up with the threat.  [Read More]"
https://www.securityweek.com/microsoft-investigating-windows-7-vulnerability-reported-highly-critical,"Microsoft Investigating Windows 7 Vulnerability Reported as ""Highly Critical""",Microsoft said it is investigating reports of new Windows 7 bug that could be leveraged by attackers to run malicious code.  [Read More]
https://www.securityweek.com/wikileaks-details-more-windows-attack-tools-used-cia,WikiLeaks Details More Windows Attack Tools Used by CIA,WikiLeaks has published more documents detailing Windows attack tools allegedly used by the CIA  [Read More]
https://www.securityweek.com/microsoft-kills-support-windows-vista,Microsoft Kills Support for Windows Vista,"Microsoft this week ended support for its Windows Vista operating systems, while at the same time rolling out Windows 10 Creators Update to its users.  [Read More]"
https://www.securityweek.com/windows-trojan-targets-android-ios-devices-usb-connection,"Windows Trojan Targets Android, iOS Devices via USB Connection",A Windows Trojan named DualToy uses USB connections to load risky and malicious apps onto Android and iOS devices  [Read More]
https://www.securityweek.com/apt3-group-using-windows-ole-vulnerability-fireeye,APT3 Group Using Windows OLE Vulnerability: FireEye,Researchers at FireEye say the APT3 group is now using exploits for recently-patched Windows vulnerabilities.  [Read More]
https://www.securityweek.com/google-prompts-windows-users-if-chrome-settings-hijacked,Google Warns Windows Users if Chrome Settings Hijacked,The prompts follow other efforts by Google to help users whose browser settings have been changed by suspicious extensions.  [Read More]
https://www.securityweek.com/attackers-exploiting-windows-xp-zero-day-use-multiple-techniques-thwart-analysis,Attackers Exploiting Windows XP Zero-Day Use Multiple Techniques to Thwart Analysis,Trend Micro discusses the techniques attackers are using to make life difficult for malware analysts.  [Read More]
https://www.securityweek.com/malware-uses-android-gateway-infect-microsoft-windows,Malware Uses Android as Gateway to Infect Microsoft Windows,Kaspersky Lab uncovered malware on Google Play that turns Windows computers into listening devices when an infect Android device is connected to the PC.  [Read More]
https://www.securityweek.com/cybercriminals-target-windows-8-users-phishing-rogue-av-attacks,"Cybercriminals Target Windows 8 Users for Phishing, Rogue AV Attacks","Attackers are seizing upon the news surrounding Windows 8, and have launched malware that is packaged to look like a security program made for Windows 8.  [Read More]"
https://www.securityweek.com/microsoft-windows-worm-abuses-weak-password-practices,Microsoft Windows Worm Abuses Weak Password Practices,"Dubbed Morto, the worm doesn’t use a vulnerability, but instead propagates by compromising Remote Desktop connections on a network through brute forcing attacks.  [Read More]"
https://www.securityweek.com/microsoft-brings-windows-defender-atp-windows-7-81,"Microsoft Brings Windows Defender ATP to Windows 7, 8.1",Microsoft announced plans to make Windows Defender Advanced Threat Protection (ATP) available for Windows 7 SP1 and Windows 8.1 devices.  [Read More]
https://www.securityweek.com/windows-10-detects-reflective-dll-loading-microsoft,Windows 10 Detects Reflective DLL Loading: Microsoft,"Windows 10 Creators Update can detect reflective Dynamic-Link Library (DLL) loading in a variety of high-risk processes, including browsers and productivity software, Microsoft says.  [Read More]"
https://www.securityweek.com/windows-defender-immune-avgater-quarantine-flaw-microsoft,Windows Defender Immune to AVGater Quarantine Flaw: Microsoft,"A recently disclosed vulnerability that allows an attacker to abuse the quarantine feature of anti-virus products to escalate privileges doesn’t affect Windows Defender, Microsoft says.  [Read More]"
https://www.securityweek.com/microsoft-publishes-standards-highly-secure-windows-10-devices,"Microsoft Publishes Standards for ""Highly Secure"" Windows 10 Devices",Microsoft has published information on the required standards to have a Windows 10 device be considered highly secure.  [Read More]
https://www.securityweek.com/windows-10-exploit-guard-boosts-endpoint-defenses,Windows 10 Exploit Guard Boosts Endpoint Defenses,"Windows Defender Exploit Guard that ships with Windows 10 Fall Creators Update, systems running Microsoft’s Windows 10 operating system can fend off emerging threats, Microsoft says.  [Read More]"
https://www.securityweek.com/windows-10-can-detect-powershell-attacks-microsoft,Windows 10 Can Detect PowerShell Attacks: Microsoft,"Windows Defender ATP can detect suspicious PowerShell activities, code injection, and malicious documents, including attacks where a process connects to a web server and starts dropping and launching an app, Microsoft says.  [Read More]"
https://www.securityweek.com/next-windows-10-release-brings-improved-control-updates-privacy,"Next Windows 10 Release Brings Improved Control of Updates, Privacy","Windows 10 Creators Update will provide users with improved control over software updates and privacy settings, Microsoft says.  [Read More]"
https://www.securityweek.com/microsoft-unveils-windows-defender-security-center,Microsoft Unveils Windows Defender Security Center,"The upcoming Windows 10 Creators Update was designed to make available security protections easily accessible via a new experience called the Windows Defender Security Center, Microsoft says.  [Read More]"
https://www.securityweek.com/security-firms-allege-microsoft-anti-competitive,Security Firms Say Windows 10 Behavior is Anti-Competitive,"Kaspersky Lab believes Microsoft is abusing its dominant position to squeeze third party vendors with competitive offerings out of the Windows 10 ecosystem – and in particular, to force users to switch to Microsoft's own Defender anti-virus product.  [Read More]"
https://www.securityweek.com/microsoft-details-anti-ransomware-protection-windows-10,Microsoft Details Anti-Ransomware Protection in Windows 10,"Windows 10 Anniversary Update brings improved ransomware protection, according to Microsoft.  [Read More]"
https://www.securityweek.com/sophos-products-detect-legitimate-windows-file-malware,Sophos Products Detect Legitimate Windows File as Malware,Sophos products caused problems for some system administrators after detecting a legitimate Windows file as malware  [Read More]
https://www.securityweek.com/secure-boot-vulnerability-exposes-windows-devices-attacks,Secure Boot Vulnerability Exposes Windows Devices to Attacks,Microsoft has been attempting to patch a serious Secure Boot vulnerability that researchers believe cannot be completely patched  [Read More]
https://www.securityweek.com/researchers-use-disk-cleanup-bypass-uac-windows-10,Researchers Use Disk Cleanup to Bypass UAC on Windows 10,Researchers manage to bypass User Account Control (UAC) on Windows 10 by abusing Disk Cleanup utility  [Read More]
https://www.securityweek.com/no-patches-quicktime-flaws-apple-ends-support-windows,No Patches for QuickTime Flaws as Apple Ends Support on Windows,Apple ends support for QuickTime on Windows and does not intend to patch two recently-discovered remote code execution flaws  [Read More]
https://www.securityweek.com/defense-agencies-upgrade-4-million-devices-windows-10,Defense Agencies to Upgrade 4 Million Devices to Windows 10,The United States Department of Defense (DoD) has directed all U.S. DoD agencies to upgrade devices within their organizations to Microsoft Windows 10 by February 2017.  [Read More]
https://www.securityweek.com/microsoft-details-windows-10-security-and-identity-protection-features,Microsoft Details Windows 10 Security and Identity Protection Features,Windows 10 will include new information and identity protection mechanisms designed to address modern security threats.  [Read More]
https://www.securityweek.com/windows-81-set-october-18-release-microsoft,Windows 8.1 Set for October 18 Release: Microsoft,"Microsoft's Windows 8.1 operating system which restores the ""Start"" button missed by users and updates other features will be available on October 18, the company said.  [Read More]"
https://www.securityweek.com/imation-puts-secure-windows-7-environment-usb-drive,Imation Puts Secure Windows 7 Environment on USB Drive,Imation announced that the latest version of their Stealth Zone mobile workspace (version 2.1) will include a fully functional version of Windows 7.  [Read More]
https://www.securityweek.com/microsoft-patch-tuesday-closes-critical-windows-internet-explorer-security-holes,"Microsoft Patch Tuesday Closes Critical Windows, Internet Explorer Security Holes","Microsoft fixes vulnerabilities in Windows, Internet Explorer and other products in its June security update.  [Read More]"
